Import Date,PO Number,Item Name,Brand Name,Size,Order Qty
,,,,,
3/30/2022,Sample FRVN220330-1=>6/MCS/TEST SS23,Eyestay Zenchill XXII #59701-ET,,5-6,25
3/30/2022,Sample FRVN220330-1=>6/MCS/TEST SS23,Eyestay Zenchill XXII #59701-ET,,5-6,25
3/30/2022,Sample FRVN220330-1=>6/MCS/TEST SS23,Eyestay Zenchill XXII #59701-ET,,8-9,25
3/30/2022,Sample FRVN220330-1=>6/MCS/TEST SS23,Eyestay Zenchill XXII #59701-ET,,5-6,25
3/30/2022,Sample FRVN220330-1=>6/MCS/TEST SS23,Eyestay Zenchill XXII #59701-ET,,8-9,50
3/30/2022,Sample DEV CUONG Order_ HC for SPG_220328,Heel Counter 05091,Adidas,No.4(9.5-11),5
3/30/2022,Sample DEV CUONG Order_ HC for SPG_220328,Heel Counter 05091,Adidas,No.3(7.5-9),5
3/30/2022,Sample DEV CUONG Order_ HC for SPG_220328,Heel Counter 08502,Adidas,No.1(3.5-6.5),5
3/30/2022,Sample ENR2203300001,NB CR M/W574,NB,M:4-8.5/W:5.5-10,7
3/30/2022,Sample ENR2203300002 ( Giao kho PT),NB CR M/W574,NB,M:9-11.5/W:10.5-13,1
3/30/2022,Sample ENR2203300002 ( Giao kho PT),NB CR M/W574,NB,M:12-18/W:13.5-19,1
3/30/2022,Sample ENR2203300002 ( Giao kho PT),NB CR M/W574,NB,M:4-8.5/W:5.5-10,1
3/30/2022,Sample VDM20220311-52-59,Outsole AB80v1,NB,10-10.5,3
3/30/2022,SAMPLE: VDM_2022/01/28,Outsole Future FG-AG #FB1118,Puma,6,10
3/30/2022,FMVN-22012204-14+FMVN-22021902-11,Outsole Future MG Jr #FB1096,Puma,3-3.5,30
3/30/2022,SAMPLE: PUMA_2022/03/30,Outsole FW20 Puma Future 2.0 #FB1064,Puma,10,2
3/30/2022,SAMPLE: PUMA_2022/03/30,Outsole FW20 Puma Future 2.0 #FB1064,Puma,8,2
3/30/2022,SAMPLE: PUMA_2022/03/30,Outsole FW20 Puma Future 2.0 #FB1064,Puma,13,2
3/30/2022,SAMPLE: PUMA_2022/03/30,Outsole FW20 Puma Future 2.0 #FB1064,Puma,6,2
3/30/2022,SAMPLE: FMVN-22021001,Outsole Ultra FG #FB1106 P4,Puma,8-8.5,5
3/30/2022,C-YY2DB-220329-807/PM220325-021U=>030C,Plate Velosamba #AD-45015,Adidas,8.5-9,40
3/30/2022,Sample ENR2202160005,Shank BB2WXYV3,NB,9.5-12,13
3/30/2022,Sample ENR2202160005,TPU BB2WXYV3,NB,12.5-13.5,13
3/30/2022,DEV REQUEST,TPU Lateral & Medial #BBKLV3,NB,11.5-13,10
3/30/2022,DEV REQUEST,TPU Lateral & Medial #BBKLV3,NB,13.5-15,10
3/29/2022,Sample DEV CUONG Order_ HC for SPG_220328,Heel Counter 05091,Adidas,No.4(9.5-11),5
3/29/2022,Sample DEV CUONG Order_ HC for SPG_220328,Heel Counter 05091,Adidas,No.3(7.5-9),5
3/29/2022,Sample DEV CUONG Order_ HC for SPG_220328,Heel Counter 08502,Adidas,No.1(3.5-6.5),5
3/29/2022,Sample DEV CUONG Order_ HC for HSV_220326,Heel counter 19449,Adidas,No.2(6.5-9),10
3/29/2022,Sample DEV CUONG Order_ HC for HSV_220326,Heel counter 19449,Adidas,No.1(3.5-6),10
3/29/2022,Sample DEV CUONG Order_ HC for HSV_220326,Heel Counter 2126,Adidas,No.3(8-10),10
3/29/2022,Sample DEV CUONG Order_ HC for HSV_220326,Heel Counter 2126,Adidas,No.2(5.5-7.5),10
3/29/2022,Sample DEV CUONG Order_ HC for HSV_220326,Heel Counter 2135,Adidas,No.3(8-10),10
3/29/2022,Sample DEV CUONG Order_ HC for HSV_220326,Heel Counter 2135,Adidas,No.2(5.5-7.5),10
3/29/2022,SAMPLE: 20220323,Heel Counter TS030,Puma,No.4(7.5-8.5),50
3/29/2022,SAMPLE: VDM_2022/03/29,Outsole #FB1079,Puma,8,10
3/29/2022,Sample 8000031752/D-RON10034 MCS SS23,Outsole Agility SG#42663,Adidas,8.5,12
3/29/2022,Sample 8000031752/D-RON00035 MCS SS23,Outsole Agility SG#42663,Adidas,8.5,12
3/29/2022,Sample 8000023805/D-RON60007 CR1 FW23,Outsole Agility SG#42663,Adidas,8.5,12
3/29/2022,Sample 8000025378/DEV-ROS1341 PAO SS22,Outsole Agility SG#42663,Adidas,7,2
3/29/2022,Sample BAS21120046T; 47T;48T,Outsole ELMN8 V7 #40533,Brooks,6-6.5,1
3/29/2022,Sample BAS21120046T; 47T;48T,Outsole ELMN8 V7 #40533,Brooks,10-10.5,1
3/29/2022,SAMPLE: VDM_2022/03/29,Outsole Future MG #FB1095,Puma,8-8.5,4
3/29/2022,SAMPLE: VDM_2022/03/29,Outsole Future MG #FB1095,Puma,8-8.5,4
3/29/2022,SAMPLE: VDM_2022/03/29,Outsole Future MG #FB1095,Puma,8-8.5,4
3/29/2022,SAMPLE: VDM_2022/03/29,Outsole Future MG #FB1095,Puma,8-8.5,4
3/29/2022,Sample BAS21120046T; 47T;48T,Outsole Wire 8 #40534,Brooks,13,1
3/29/2022,Sample BAS21120046T; 47T;48T,Outsole Wire 8 #40534,Brooks,5-5.5,1
3/29/2022,DEV REQUEST,Shank Propelv4 #PROPELV4,NB,M:6.5-7.5/W:8-9,10
3/29/2022,DEV REQUEST,Shank Propelv4 #PROPELV4,NB,M:11-12,10
3/29/2022,V-PYV172-220314-001/D32203090186,Torsion Bar Solar boost Glide ST #AD-32573,Adidas,8-9,2
3/29/2022,V-PYV172-220314-001/D32203090186,Torsion Bar Solar boost Glide ST #AD-32573,Adidas,11-12,1
3/29/2022,V-PYV172-220314-001/D32203090186,Torsion Bar Solar boost Glide ST #AD-32573,Adidas,9.5-10.5,3
3/29/2022,Sample DEV THAO 20220329/Material Trials Inline  S,Torsion Bar Solar Prime #AD-44000,Adidas,8-9,15
3/28/2022,Sample 88000031475/DEV-LHC009 MCS SS23,Heel Counter 21005,Adidas,No.3(5-6),200
3/28/2022,A-FRA220326,Heelcap Ultra 4D #AD30832,Adidas,8-9,18
3/28/2022,A-FRA220326,Heelcap Ultra 4D #AD30832,Adidas,8-9,12
3/28/2022,A-FRA220326,Heelcap Ultra 4D #AD30832,Adidas,8-9,10
3/28/2022,Sample ENR2203280002,Insole Board JV8-0665 LH-2,NB,9.5-10,7
3/28/2022,Sample ENR2203280002,Insole Board JV8-0665 LH-2,NB,7.5-8,3
3/28/2022,Sample ENR2203280002,Insole Board JV8-0665 LH-2,NB,10.5-11,1
3/28/2022,A-FRA220326,Midsole Shift #61086,Adidas,8.5,5
3/28/2022,A-FRA220326,Midsole Shift #61086,Adidas,5.5,5
3/28/2022,A-FRA220326,Midsole Shift #61086,Adidas,8.5,5
3/28/2022,A-FRA220326,Midsole Shift #61086,Adidas,5.5,5
3/28/2022,Sample ENR2203280001,NB CR M/W574,NB,M:9-11.5/W:10.5-13,4
3/28/2022,Sample ENR2203280001,NB CR M/W574,NB,M:9-11.5/W:10.5-13,8
3/28/2022,Sample 8000031333/D-RON10030 SMS SS23,Outsole Agility SG#42663,Adidas,8.5,6
3/28/2022,Sample 8000031333/D-RON00035 SMS SS23,Outsole Agility SG#42663,Adidas,8.5,8
3/28/2022,Sample 8000031333/D-RON00036 SMS SS23,Outsole Agility SG#42663,Adidas,8.5,12
3/28/2022,Sample ENR2203280002,Outsole Furon 6 FG #PFG002,NB,9.5-10,7
3/28/2022,Sample ENR2203280002,Outsole Furon 6 FG #PFG002,NB,7.5-8,3
3/28/2022,Sample ENR2203280002,Outsole Furon 6 FG #PFG002,NB,10.5-11,1
3/28/2022,SAMPLE: 20220325,Outsole Future MG #FB1095,Puma,8-8.5,20
3/28/2022,SAMPLE: 20220325,Outsole Future MG #FB1095,Puma,8-8.5,20
3/28/2022,SAMPLE: 20220325,Outsole Future MG #FB1095,Puma,8-8.5,20
3/28/2022,SAMPLE: 20220325,Outsole Future MG #FB1095,Puma,8-8.5,20
3/28/2022,YXLB220323001,Outsole Future MG #FB1095,Puma,8-8.5,8
3/28/2022,Sample ENR2106030004,Outsole Tekela V2 FG #PFG001,NB,9.5-10,8
3/28/2022,Sample ENR2106030004,Outsole Tekela V2 FG #PFG001,NB,7.5-8,2
3/28/2022,Sample ENR2106030004,Outsole Tekela V2 FG #PFG001,NB,11.5-12,2
3/28/2022,Sample ENR2106030004,Outsole Tekela V2 FG #PFG001,NB,10.5-11,4
3/28/2022,Sample ENR2106030004,Outsole Tekela V2 FG #PFG001,NB,8.5-9,8
3/28/2022,Sample ENR2106030005,Outsole Tekela V2 SG #PSG001,NB,9.5-10,3
3/28/2022,Sample ENR2106030005,Outsole Tekela V2 SG #PSG001,NB,7.5-8,1
3/28/2022,Sample ENR2106030005,Outsole Tekela V2 SG #PSG001,NB,9.5-10,3
3/28/2022,Sample ENR2106030005,Outsole Tekela V2 SG #PSG001,NB,11.5-12,2
3/28/2022,Sample ENR2106030005,Outsole Tekela V2 SG #PSG001,NB,10.5-11,2
3/28/2022,Sample ENR2106030005,Outsole Tekela V2 SG #PSG001,NB,8.5-9,3
3/28/2022,Sample ENR2106030005,Outsole Tekela V2 SG #PSG001,NB,7.5-8,1
3/28/2022,Sample ENR2106030005,Outsole Tekela V2 SG #PSG001,NB,11.5-12,2
3/28/2022,Sample ENR2106030005,Outsole Tekela V2 SG #PSG001,NB,10.5-11,2
3/28/2022,Sample ENR2106030005,Outsole Tekela V2 SG #PSG001,NB,8.5-9,3
3/28/2022,SAMPLE: 20220322,Outsole Ultra FG #FB1106 P3,Puma,8-8.5,20
3/28/2022,SAMPLE: 20220322,Outsole Ultra FG #FB1106 P3,Puma,8-8.5,20
3/28/2022,SAMPLE: 20220322,Outsole Ultra FG #FB1106 P3,Puma,8-8.5,20
3/28/2022,SAMPLE: 20220322,Outsole Ultra FG #FB1106 P3,Puma,8-8.5,20
3/28/2022,SAMPLE: 20220322,Outsole Ultra FG #FB1106 P3,Puma,8-8.5,20
3/28/2022,SAMPLE: 20220322,Outsole Ultra FG #FB1106 P3,Puma,8-8.5,20
3/28/2022,SAMPLE: 20220322,Outsole Ultra FG #FB1106 P3,Puma,8-8.5,20
3/28/2022,SAMPLE: 20220322,Outsole Ultra FG #FB1106 P3,Puma,8-8.5,20
3/28/2022,SAMPLE: 20220322,Outsole Ultra FG #FB1106 P3,Puma,8-8.5,20
3/28/2022,SAMPLE: 20220322,Outsole Ultra FG #FB1106 P3,Puma,8-8.5,20
3/28/2022,SAMPLE: 20220322,Outsole Ultra FG #FB1106 P3,Puma,8-8.5,20
3/28/2022,SAMPLE: 20220322,Outsole Ultra FG #FB1106 P3,Puma,8-8.5,20
3/28/2022,A-FRA220326,Panel EQ19 RUN #55178,Adidas,8-8.5,2
3/28/2022,A-FRA220326,Panel EQ19 RUN #55178,Adidas,8-8.5,2
3/28/2022,Claim sample FRVN220217-1=>4 (Urgent) /MCS FW22,Panel EQ19 RUN #55178,Adidas,5-5.5,25
3/28/2022,Claim sample FRVN220217-1=>4 (Urgent) /MCS FW22,Panel EQ19 RUN #55178,Adidas,5-5.5,25
3/28/2022,A-FRA220326,PANEL ULTRA 4D #AD30832,Adidas,8-9,18
3/28/2022,A-FRA220326,PANEL ULTRA 4D #AD30832,Adidas,8-9,10
3/28/2022,A-FRA220326,PANEL ULTRA 4D #AD30832,Adidas,8-9,12
3/28/2022,Sample EGR2203280001 ( URGENT),Shank Hyperion Rocket,Brooks,9-9.5,10
3/28/2022,A-FRA220326,Torsion Bar Hiit Quick Burn ADV trainer #61698-TB,,8-9,7
3/28/2022,A-FRA220326,Torsion Bar Hiit Quick Burn ADV trainer #61698-TB,,8-9,3
3/28/2022,A-FRA220326,Torsion Bar Hiit Quick Burn ADV trainer #61698-TB,,5-6,5
3/26/2022,A-FRA220323+0325,Eyestay Zenchill XXII #59701-ET,,8-9,15
3/26/2022,Sample ENR2203110004 ( claim),Heel counter C 8-0114-M/W,NB,No.6(13-15),50
3/26/2022,A-FRA220323+0325,Heelcap Zenchill XXII #59701-HT,Adidas,8-9,15
3/26/2022,C-YY2SF -220224-009,Insole Board X20 FG #11046,Adidas,8.5,9
3/26/2022,C-YY2SF -220224-009,Insole Board X20 FG #11046,Adidas,11.5,1
3/26/2022,C-YY2SF -220224-009,Insole Board X20 FG #11046,Adidas,8,7
3/26/2022,C-YY2SF -220224-004,Outsole Plate Sprint Star #AD-39902,Adidas,8-8.5,3
3/26/2022,B3ZX22030784(C-YY2DB-220325-821)/CM220223-005U,Plate Velosamba #AD-45015,Adidas,8.5-9,9
3/26/2022,B3ZX22030743(C-YY2DB-220324-818),Plate Velosamba #AD-45015,Adidas,8.5-9,13
3/26/2022,B3ZX22030743(C-YY2DB-220324-818),Torsion Bar Adizero Adios 5 #AD-07213,Adidas,8-9,5
3/26/2022,A-FRA220323+0325,Torsion Bar Hiit Quick Burn ADV trainer #61698-TB,,8-9,15
3/26/2022,A-FRA220323+0325,Torsion Bar Hiit Quick Burn ADV trainer #61698-TB,,8-9,33
3/26/2022,A-FRA220323+0325,Torsion Bar Hiit Quick Burn ADV trainer #61698-TB,,5-6,15
3/26/2022,A-FRA220323+0325,Torsion Bar Hiit Quick Burn ADV trainer #61698-TB,,8-9,5
3/26/2022,A-FRA220323+0325,Torsion Bar Hiit Quick Burn ADV trainer #61698-TB,,5-6,5
3/26/2022,A-FRA220323+0325,Torsion Bar Hiit Quick Burn ADV trainer #61698-TB,,8-9,5
3/26/2022,A-FRA220323+0325,Torsion Bar Hiit Quick Burn ADV trainer #61698-TB,,5-6,5
3/26/2022,A-FRA220323+0325,Torsion Bar Hiit Quick Burn ADV trainer #61698-TB,,5-6,33
3/25/2022,Sample FRVN220325-1/SMS/MCS SS23,Eyestay Zenchill XXII #59701-ET,,8-9,55
3/25/2022,Sample GFRVN220325P136018-NB/GFRVN220325P136019-NB,NB CR M/W574,NB,M:4-8.5/W:5.5-10,15
3/25/2022,Sample GFRVN220325P136018-NB/GFRVN220325P136019-NB,NB CR M/W574,NB,M:4-8.5/W:5.5-10,15
3/25/2022,Sample GFRVN220325P136018-NB/GFRVN220325P136019-NB,NB CR M/W574,NB,M:4-8.5/W:5.5-10,15
3/25/2022,Sample GFRVN220325P136018-NB/GFRVN220325P136019-NB,NB CR M/W574,NB,M:4-8.5/W:5.5-10,15
3/25/2022,Sample GFRVN220325P136018-NB/GFRVN220325P136019-NB,NB CR M/W574,NB,M:4-8.5/W:5.5-10,15
3/25/2022,Sample GFRVN220325P136018-NB/GFRVN220325P136019-NB,NB CR M/W574,NB,M:4-8.5/W:5.5-10,15
3/25/2022,sample ENR2202190025/ENR2202190022 ( rv 04 march),Outsole Furon 6 FG #PFG002,NB,9.5-10,6
3/25/2022,Sample ENR2202170017 ( Giao kho PT) ( urgent),Outsole Furon 6 FG #PFG002,NB,9.5-10,5
3/25/2022,Sample ENR2202170017 ( Giao kho PT) ( urgent),Outsole Furon 6 FG #PFG002,NB,7.5-8,5
3/25/2022,Sample ENR2202170017 ( Giao kho PT) ( urgent),Outsole Furon 6 FG #PFG002,NB,11.5-12,5
3/25/2022,Sample ENR2202170017 ( Giao kho PT) ( urgent),Outsole Furon 6 FG #PFG002,NB,10.5-11,5
3/25/2022,Sample ENR2202170017 ( Giao kho PT) ( urgent),Outsole Furon 6 FG #PFG002,NB,8.5-9,10
3/25/2022,VDM_2022/03/21,Outsole FW20 Puma Future 2.0 #FB1064,Puma,5,10
3/25/2022,Sample 8000031247/D-ROS70066 SMS SS23,Outsole Generic NMZ/X P2/P3 MG Jr #21316,Adidas,3-3.5,4
3/25/2022,Sample 8000031247/D-ROS20177 SMS SS23,Outsole Generic NMZ/X P2/P3 MG Jr #21316,Adidas,3-3.5,5
3/25/2022,Sample 6000044848/GW1996/MCS SS22,Outsole Originals Stan Smith Loop #AD-56914,Adidas,8.5,8
3/25/2022,Sample 6000044278/HQ3961/FGT FW22,Outsole Originals Stan Smith Loop #AD-56914,Adidas,8.5,25
3/25/2022,FMVN-22012205,Outsole Ultra FG #FB1106 P3,Puma,8-8.5,10
3/25/2022,FMVN-22012205,Outsole Ultra FG #FB1106 P3,Puma,8-8.5,10
3/25/2022,FMVN-22012205,Outsole Ultra FG #FB1106 P4,Puma,6-6.5,25
3/25/2022,A-FRA220111-P2,PANEL ULTRA 4D #AD30832,Adidas,8-9,15
3/25/2022,SAMPLE: FRAVNB220017+20,Shank Answer IV R1116D,Reebok,M:8.5-9,10
3/25/2022,SAMPLE: FRAVNB220017+20,Shank Answer IV R1116D,Reebok,M:8.5-9,10
3/25/2022,SAMPLE: FRAVNB220017+20,Shank Answer IV R1116D,Reebok,M:8.5-9,22
3/25/2022,DEV REQUEST,Test Plates NB,NB,non size,10
3/25/2022,DEV REQUEST,Test Plates NB,NB,non size,10
3/25/2022,DEV REQUEST,Test Plates NB,NB,non size,10
3/25/2022,DEV REQUEST,Test Plates NB,NB,non size,10
3/25/2022,DEV REQUEST,Test Plates NB,NB,non size,10
3/25/2022,Sample 6000044275/HQ1015/LKS SS23,Torsion Bar #AF0207M,Adidas,8-9,6
3/25/2022,SAMPLE: FRAVNB220017+20,TPU Shank Base Line 1.0 #50062001,Reebok,M:8-9(W:9.5-10.5),10
3/25/2022,SAMPLE: FRAVNB220017+20,TPU Shank Base Line 1.0 #50062001,Reebok,M:8-9(W:9.5-10.5),10
3/25/2022,SAMPLE: FRAVNB220017+20,TPU Shank Base Line 1.0 #50062001,Reebok,M:8-9(W:9.5-10.5),10
3/24/2022,Sample ENR2202230022/ ENR2203110003( Free of charg,Heel counter #CTJSV1,NB,M:7.5-9/W:9-10.5,27
3/24/2022,SAMPLE: FRAVNU220009,Heel Counter A1004,Adidas,No.2(8-9),400
3/24/2022,Sample AOS-FRVN-220324-01/CS1 SS23,Heel Counter A1006,Adidas,No.1(3-4.5),200
3/24/2022,Sample AOS-FRVN-220324-01/CS1 SS23,Heel Counter A1006,Adidas,No.4(8-9),200
3/24/2022,SAMPLE 20220324,Heel counter C 8-0114-M/W,NB,No.2(5.5-7),10
3/24/2022,SAMPLE 20220324,Heel counter C 8-0114-M/W,NB,No.4(9.5-11),10
3/24/2022,DEV-TAI-2022-03-24,Heelcap Ultra 4D #AD30832,Adidas,8-9,20
3/24/2022,Sample ENR2203240003/ENR2203240005,Insole Board JV8-0425-1,NB,9.5-10,2
3/24/2022,Sample ENR2203240003/ENR2203240005,Insole Board JV8-0425-1,NB,13.5-14,2
3/24/2022,Sample ENR2203240003/ENR2203240005,Insole Board JV8-0425-1,NB,7.5-8,2
3/24/2022,Sample ENR2203240003/ENR2203240005,Insole Board JV8-0425-1,NB,6.5-7,2
3/24/2022,Sample ENR2203240003/ENR2203240005,Insole Board JV8-0425-1,NB,12.5-13,2
3/24/2022,Sample ENR2203240003/ENR2203240005,Insole Board JV8-0425-1,NB,8.5-9,2
3/24/2022,Sample ENR2203240006,Insole Board JV8-0665 LH-2,NB,9.5-10,10
3/24/2022,B3ZX22030671(C-YY2DB-220322-813)/CS211117-011M=>DS,Insole Board X20 FG #11046,Adidas,8.5,79
3/24/2022,B40X22030010(C-YY2DC-220308-801)/DT220304-004N+005,Insole Board X20 FG #11046,Adidas,8.5,127
3/24/2022,DS220308-005L(C-YY2DB-220310-822),Insole Board X20 FG #11046,Adidas,4,1
3/24/2022,DS220308-005L(C-YY2DB-220310-822),Insole Board X20 FG #11046,Adidas,8,1
3/24/2022,DS220308-005L(C-YY2DB-220310-822),Insole Board X20 FG #11046,Adidas,10,1
3/24/2022,DS220308-005L(C-YY2DB-220310-822),Insole Board X20 FG #11046,Adidas,10.5,1
3/24/2022,DS220308-005L(C-YY2DB-220310-822),Insole Board X20 FG #11046,Adidas,8.5,1
3/24/2022,DS220308-005L(C-YY2DB-220310-822),Insole Board X20 FG #11046,Adidas,5.5,1
3/24/2022,DS220308-005L(C-YY2DB-220310-822),Insole Board X20 FG #11046,Adidas,13,1
3/24/2022,DS220308-005L(C-YY2DB-220310-822),Insole Board X20 FG #11046,Adidas,9.5,1
3/24/2022,DS220308-005L(C-YY2DB-220310-822),Insole Board X20 FG #11046,Adidas,12.5,1
3/24/2022,DS220308-005L(C-YY2DB-220310-822),Insole Board X20 FG #11046,Adidas,6,1
3/24/2022,DS220308-005L(C-YY2DB-220310-822),Insole Board X20 FG #11046,Adidas,7,1
3/24/2022,DS220308-005L(C-YY2DB-220310-822),Insole Board X20 FG #11046,Adidas,11.5,1
3/24/2022,DS220308-005L(C-YY2DB-220310-822),Insole Board X20 FG #11046,Adidas,6.5,1
3/24/2022,DS220308-005L(C-YY2DB-220310-822),Insole Board X20 FG #11046,Adidas,9,1
3/24/2022,DS220308-005L(C-YY2DB-220310-822),Insole Board X20 FG #11046,Adidas,5,1
3/24/2022,DS220308-005L(C-YY2DB-220310-822),Insole Board X20 FG #11046,Adidas,12,1
3/24/2022,DS220308-005L(C-YY2DB-220310-822),Insole Board X20 FG #11046,Adidas,8.5,10
3/24/2022,DS220308-005L(C-YY2DB-220310-822),Insole Board X20 FG #11046,Adidas,4.5,1
3/24/2022,DS220308-005L(C-YY2DB-220310-822),Insole Board X20 FG #11046,Adidas,11,1
3/24/2022,DS220308-005L(C-YY2DB-220310-822),Insole Board X20 FG #11046,Adidas,7.5,1
3/24/2022,DS220308-005L(C-YY2DB-220310-822),Insole Board X20 FG #11046,Adidas,3.5,1
3/24/2022,C-YY2DA -220305-039,Midsole Blades Adizero SUB 2 #AD-53755,Adidas,8-9,42
3/24/2022,C-YY2DA -220305-039,Midsole Blades Adizero SUB 2 #AD-53755,Adidas,8-9,42
3/24/2022,C-YY2DA -220305-039,Midsole Blades Adizero SUB 2 #AD-53755,Adidas,8-9,42
3/24/2022,Sample GFRVN220324P136017-NB,NB CR M/W574,NB,M:4-8.5/W:5.5-10,12
3/24/2022,Sample GFRVN220324P136017-NB,NB CR M/W574,NB,M:4-8.5/W:5.5-10,12
3/24/2022,Sample GFRVN220324P136017-NB,NB CR M/W574,NB,M:4-8.5/W:5.5-10,12
3/24/2022,Sample GFRVN220324P136017-NB,NB CR M/W574,NB,M:4-8.5/W:5.5-10,12
3/24/2022,Sample GFRVN220324P136017-NB,NB CR M/W574,NB,M:4-8.5/W:5.5-10,12
3/24/2022,Sample NSDO2200097,Outsole Adipower 3 Boost FF+RF #AD-41629,Adidas,8.5-9,3
3/24/2022,Sample NSDO2200085/SMS SS23,Outsole Adipower 3 Boost FF+RF #AD-41629,Adidas,8.5-9,11
3/24/2022,Sample NSDO2200085/SMS SS23,Outsole Adipower 3 Boost FF+RF #AD-41629,Adidas,8.5-9,17
3/24/2022,Sample NSDO2200085/SMS SS23,Outsole Adipower 3 Boost FF+RF #AD-41629,Adidas,8.5-9,18
3/24/2022,Sample NSDO2200083/SMS SS23,Outsole Adipower 3 Boost FF+RF #AD-41629,Adidas,8.5-9,10
3/24/2022,Sample NSDO2200083/SMS SS23,Outsole Adipower 3 Boost FF+RF #AD-41629,Adidas,8.5-9,10
3/24/2022,Sample NSDO2200074/CS1 SS23,Outsole Adipower 3 Boost FF+RF #AD-41629,Adidas,8.5-9,34
3/24/2022,Sample ENR2203240002,Outsole AG02 #NSM-AG02,NB,6.5-7,4
3/24/2022,Sample ENR2203240002,Outsole AG02 #NSM-AG02,NB,12.5-13,4
3/24/2022,Sample ENR2203240002,Outsole AG02 #NSM-AG02,NB,8.5-9,4
3/24/2022,Sample 8000031020/DEV-ROS2296 MCS SS23,Outsole Agility SG#42663,Adidas,8.5,22
3/24/2022,Sample ENR2203240007,Outsole Furon 6 FG #PFG002,NB,9.5-10,10
3/24/2022,C-YY2DA -220307-011,Outsole Olympic Plate #AD-06636,,8-8.5,33
3/24/2022,C-YY2DA -220307-011,Outsole Olympic Plate #AD-06636,,8-8.5,9
3/24/2022,C-YY2SF -220314-006,Outsole Olympic Plate #AD-06636,,8-8.5,8
3/24/2022,C-YY2SF -220314-006,Outsole Olympic Plate #AD-06636,,8-8.5,3
3/24/2022,C-YY2SF -220314-006,Outsole Plate Sprint Star #AD-39902,Adidas,8-8.5,2
3/24/2022,C-YY2SF -220314-006,Outsole Plate Sprint Star #AD-39902,Adidas,8-8.5,3
3/24/2022,Sample ENR2203240008,Outsole Tekela 4 FG #PFG004,NB,9.5-10,10
3/24/2022,Sample NSDO2200061/CS1 SS23,Outsole  Adipower 3 Boost Spine #AD-41629,Adidas,8.5,5
3/24/2022,Sample NSDO2200061/CS1 SS23,Outsole  Adipower 3 Boost Spine #AD-41629,Adidas,8.5,5
3/24/2022,Sample NSDO2200083/SMS SS23,Outsole  Adipower 3 Boost Spine #AD-41629,Adidas,8.5,10
3/24/2022,Sample NSDO2200083/SMS SS23,Outsole  Adipower 3 Boost Spine #AD-41629,Adidas,8.5,10
3/24/2022,Sample NSDO2200085/SMS SS23,Outsole  Adipower 3 Boost Spine #AD-41629,Adidas,8.5,11
3/24/2022,Sample NSDO2200085/SMS SS23,Outsole  Adipower 3 Boost Spine #AD-41629,Adidas,8.5,17
3/24/2022,Sample NSDO2200085/SMS SS23,Outsole  Adipower 3 Boost Spine #AD-41629,Adidas,8.5,18
3/24/2022,Sample NSDO2200097,Outsole  Adipower 3 Boost Spine #AD-41629,Adidas,8.5,3
3/24/2022,DEV-TAI-2022-03-24,PANEL ULTRA 4D #AD30832,Adidas,9.5-10.5,20
3/24/2022,DEV REQUEST,Shank BB2WXYV3,NB,9.5-12,10
3/24/2022,B3ZX22030585(C-YY2DB-220318-821)/AA220318-024X+025,Torsion Bar (Rod) AVANTI 25 #AD-56677,Adidas,8.5-9.5,1
3/24/2022,B3ZX22030585(C-YY2DB-220318-821)/AA220318-024X+025,Torsion Bar (Rod) AVANTI 25 #AD-56677,Adidas,8.5-9.5,1
3/24/2022,B3ZX22030585(C-YY2DB-220318-821)/AA220318-024X+025,Torsion Bar (Rod) AVANTI 25 #AD-56677,Adidas,8.5-9.5,1
3/24/2022,B3ZX22030669(C-YY2DB-220322-811)/DA220321-018I=>02,Torsion Bar Adizero Pro V2 #AD-52582,Adidas,8.5-9,8
3/23/2022,Sample FRAMAS-SS23-0323-FIT WEAR-AD/Fit Wear SS23,Banadage MTBR Adilette #61679,Adidas,9,22
3/23/2022,Sample FRAMAS-SS23-0322-THU KEO-AD/SS23,Banadage MTBR Adilette #61679,Adidas,9,10
3/23/2022,Sample DEV QUYNH20220322/Material Trials SS23,Banadage MTBR Adilette #61679,Adidas,9,40
3/23/2022,Sample DEV QUYNH20220322/Material Trials SS23,Banadage MTBR Adilette #61679,Adidas,9,15
3/23/2022,Sample AOS-FRVN-220323-01/PROMO SS22,Heel Counter 61BAS,Adidas,No.3(9.5-12),400
3/23/2022,Sample NSDO2200060/CS1 SS23,Outsole Adipower 3 Boost FF+RF #AD-41629,Adidas,8.5-9,5
3/23/2022,Sample NSDO2200060/CS1 SS23,Outsole Adipower 3 Boost FF+RF #AD-41629,Adidas,8.5-9,5
3/23/2022,YIIY000112FC/C-YY2DA     -220305-039,Outsole Adizero LJ #AD-30569,Adidas,9-10,32
3/23/2022,VDM_2022/02/19,Outsole Future MG #FB1095,Puma,8-8.5,13
3/23/2022,Sample FRAMAS-SS23-0323-FIT WEAR-AD/Fit Wear SS23,Outsole MTBR Adilette #61681,Adidas,9,22
3/23/2022,Sample FRAMAS-SS23-0322-THU KEO-AD/SS23,Outsole MTBR Adilette #61681,Adidas,9,10
3/23/2022,Sample DEV QUYNH20220322/Material Trials SS23,Outsole MTBR Adilette #61681,Adidas,9,15
3/23/2022,Sample VDM20220322-62-36; 37,Outsole NB PL #4040V6,NB,M's:3T/W's:5,3
3/23/2022,Sample VDM20220322-62-36; 37,Outsole NB PL #4040V6,NB,M's 6-6T/W's 7T-8,3
3/23/2022,Sample VDM20220322-62-36; 37,Outsole NB PL #4040V6,NB,M's:4-4T/W's:5T-6,6
3/23/2022,Sample VDM20220323-63-28,Outsole NB PL #4040V6,NB,M's 5-5T/W's 6T-7,4
3/23/2022,Sample VDM20220323-63-28,Outsole NB PL #4040V6,NB,M's 10-10T/W's 11T-12,4
3/23/2022,Sample VDM20220323-63-28,Outsole NB PL #4040V6,NB,M's 7-7T/W's 8T-9,4
3/23/2022,Sample VDM20220323-63-28,Outsole NB PL #4040V6,NB,M's 6-6T/W's 7T-8,4
3/23/2022,Sample VDM20220323-63-28,Outsole NB PL #4040V6,NB,M's:3T/W's:5,2
3/23/2022,Sample VDM20220323-63-28,Outsole NB PL #4040V6,NB,M's 8-8T/W's 9T-10,4
3/23/2022,Sample VDM20220323-63-28,Outsole NB PL #4040V6,NB,M's:11-11T/W's:12T-13,4
3/23/2022,Sample VDM20220323-63-28,Outsole NB PL #4040V6,NB,M's 9-9T/W's 10T-11,6
3/23/2022,Sample VDM20220323-63-28,Outsole NB PL #4040V6,NB,M's:4-4T/W's:5T-6,6
3/23/2022,Sample VDM20220322-62-36; 37,Outsole NB#MB3000V4,NB,4.5-5,3
3/23/2022,Sample VDM20220322-62-36; 37,Outsole NB#MB3000V4,NB,3.5-4,6
3/23/2022,Sample VDM20220322-62-36; 37,Outsole NB#MB3000V4,NB,6-6.5,3
3/23/2022,Sample VDM20220323-63-29,Outsole NB#MB3000V4,NB,3.5-4,4
3/23/2022,Sample VDM20220323-63-29,Outsole NB#MB3000V4,NB,9-9.5,6
3/23/2022,Sample VDM20220323-63-29,Outsole NB#MB3000V4,NB,6-6.5,4
3/23/2022,Sample VDM20220323-63-29,Outsole NB#MB3000V4,NB,7-7.5,4
3/23/2022,Sample VDM20220323-63-29,Outsole NB#MB3000V4,NB,10-10.5,4
3/23/2022,Sample VDM20220323-63-29,Outsole NB#MB3000V4,NB,11-11.5,4
3/23/2022,Sample VDM20220323-63-29,Outsole NB#MB3000V4,NB,4.5-5,6
3/23/2022,Sample VDM20220323-63-29,Outsole NB#MB3000V4,NB,8-8.5,4
3/23/2022,Sample VDM20220323-63-29,Outsole NB#MB3000V4,NB,5.5,2
3/23/2022,YIIY000112FC/C-YY2DA     -220305-039,Outsole Plate Sprint Star #AD-39902,Adidas,8-8.5,7
3/23/2022,YIIY000112FC/C-YY2DA     -220305-039,Outsole Plate Sprint Star #AD-39902,Adidas,8-8.5,43
3/23/2022,Sample ENR2202120013 ( TOP URGNET) ( RV),Outsole Tekela 4 FG #PFG004,NB,9.5-10,10
3/23/2022,Sample NSDO2200070/CS1 SS23,Outsole  Adipower 3 Boost Spine #AD-41629,Adidas,8.5,20
3/23/2022,Sample NSDO2200070/CS1 SS23,Outsole  Adipower 3 Boost Spine #AD-41629,Adidas,6.5,7
3/23/2022,Sample NSDO2200070/CS1 SS23,Outsole  Adipower 3 Boost Spine #AD-41629,Adidas,10.5,7
3/23/2022,Sample MWO22030186,Puma Twist Lock 015500,Puma,complete set,259
3/22/2022,Sample ENR2203220001/0005/0008,Insole Board JV8-0665 LH-2,NB,12.5-13,5
3/22/2022,Sample ENR2203220001/0005/0008,Insole Board JV8-0665 LH-2,NB,7.5-8,31
3/22/2022,Sample ENR2203220001/0005/0008,Insole Board JV8-0665 LH-2,NB,10.5-11,48
3/22/2022,Sample ENR2203220001/0005/0008,Insole Board JV8-0665 LH-2,NB,9.5-10,13
3/22/2022,Sample ENR2203220001/0005/0008,Insole Board JV8-0665 LH-2,NB,8.5-9,52
3/22/2022,Sample ENR2203220001/0005/0008,Insole Board JV8-0665 LH-2,NB,13.5-14,4
3/22/2022,Sample ENR2203220001/0005/0008,Insole Board JV8-0665 LH-2,NB,6.5-7,4
3/22/2022,Sample ENR2203210013,Insole Board JV8-0665 LH-2,NB,9.5-10,6
3/22/2022,YIIJ056093FV/C-TG2S4     -220125-012,Midsole Blades Adizero SUB 2 #AD-53755,,8-9,8
3/22/2022,YIIJ056093FV/C-TG2S4     -220125-012,Midsole Blades Adizero SUB 2 #AD-53755,,3.5-4.5,5
3/22/2022,YIIJ056093FV/C-TG2S4     -220125-012,Midsole Blades Adizero SUB 2 #AD-53755,,6.5-7.5,2
3/22/2022,Sample ENR2203220015,NB CR M/W574,NB,M:9-11.5/W:10.5-13,11
3/22/2022,Sample ENR2203220009,Outsole Furon 6 FG #PFG002,NB,12.5-13,2
3/22/2022,Sample ENR2203220009,Outsole Furon 6 FG #PFG002,NB,9.5-10,8
3/22/2022,Sample ENR2203220009,Outsole Furon 6 FG #PFG002,NB,10.5-11,32
3/22/2022,Sample ENR2203220009,Outsole Furon 6 FG #PFG002,NB,8.5-9,16
3/22/2022,Sample ENR2203220009,Outsole Furon 6 FG #PFG002,NB,7.5-8,13
3/22/2022,Sample ENR2203220009,Outsole Furon 6 FG #PFG002,NB,6.5-7,4
3/22/2022,Sample ENR2203220009,Outsole Furon 6 FG #PFG002,NB,13.5-14,2
3/22/2022,Sample VDM20220216-31-120==> 126 ( CLAIM) ( TOP UR,Outsole NB Composite COMPV1,NB,9.5-10,14
3/22/2022,Sample ENR2203220005/ENR2203220002,Outsole Tekela 4 FG #PFG004,NB,7.5-8,14
3/22/2022,Sample ENR2203220005/ENR2203220002,Outsole Tekela 4 FG #PFG004,NB,10.5-11,8
3/22/2022,Sample ENR2203220005/ENR2203220002,Outsole Tekela 4 FG #PFG004,NB,8.5-9,28
3/22/2022,Sample ENR2203210013,Outsole Tekela 4 FG #PFG004,NB,9.5-10,6
3/22/2022,DEV REQUEST,Outsole Tekela 4 FG #PFG004,NB,9.5-10,10
3/22/2022,DEV REQUEST,Outsole Tekela 4 FG #PFG004,NB,5.5-6,10
3/22/2022,DEV REQUEST,Outsole Tekela 4 FG #PFG004,NB,4.5-5,10
3/22/2022,DEV REQUEST,Outsole Tekela 4 FG #PFG004,NB,10.5-11,10
3/22/2022,DEV REQUEST,Outsole Tekela 4 FG #PFG004,NB,8.5-9,10
3/22/2022,DEV REQUEST,Outsole Tekela 4 FG #PFG004,NB,7.5-8,10
3/22/2022,DEV REQUEST,Outsole Tekela 4 FG #PFG004,NB,11.5-12,10
3/22/2022,DEV REQUEST,Outsole Tekela 4 FG #PFG004,NB,12.5-13,10
3/22/2022,DEV REQUEST,Outsole Tekela 4 FG #PFG004,NB,6.5-7,10
3/22/2022,Sample ENR2203220003/ENR2203220010,Outsole Tekela V2 SG #PSG001,NB,12.5-13,3
3/22/2022,Sample ENR2203220003/ENR2203220010,Outsole Tekela V2 SG #PSG001,NB,13.5-14,2
3/22/2022,Sample ENR2203220003/ENR2203220010,Outsole Tekela V2 SG #PSG001,NB,9.5-10,2
3/22/2022,Sample ENR2203220003/ENR2203220010,Outsole Tekela V2 SG #PSG001,NB,10.5-11,8
3/22/2022,Sample ENR2203220003/ENR2203220010,Outsole Tekela V2 SG #PSG001,NB,7.5-8,4
3/22/2022,Sample ENR2203220003/ENR2203220010,Outsole Tekela V2 SG #PSG001,NB,8.5-9,8
3/22/2022,YIIL058052FV/C-TG2S4     -220307-006,Plate Velosamba #AD-45015,,8.5-9,124
3/22/2022,YIIL058051FV/C-TG2S4     -220307-005,Torsion Bar Solar Boost #AD-47694,Adidas,8-9,50
3/22/2022,Sample ENR2203210007,TPU BB2WXYV3,NB,9.5-10.5,5
3/21/2022,Sample FRVN220321-1=>4/SMS/MCS SS23,Eyestay Zenchill XXII #59701-ET,,5-6,55
3/21/2022,Sample FRVN220321-1=>4/SMS/MCS SS23,Eyestay Zenchill XXII #59701-ET,,5-6,55
3/21/2022,Sample FRVN220321-1=>4/SMS/MCS SS23,Heelcap Zenchill XXII #59701-HT,Adidas,5-6,55
3/21/2022,Sample FRVN220321-1=>4/SMS/MCS SS23,Heelcap Zenchill XXII #59701-HT,Adidas,5-6,55
3/21/2022,Sample AOS-FRVN-220321-01/sms SSA22006 SS23,Insole Board #A-26006,Adidas,7.5,12
3/21/2022,Sample ENR2203210008,Insole Board JV8-0425-1,NB,9.5,3
3/21/2022,Sample ENR2203210008,Insole Board JV8-0665 LH-2,NB,9.5-10,5
3/21/2022,B3ZX22030236(C-YY2DB-220308-812)/DS220307-017M,Insole Board X20 FG #11046,Adidas,8.5,7
3/21/2022,C-YY2DB-220311-837/DS220310-015D+016D+IS220311-002,Insole Board X20 FG #11046,Adidas,8.5,16
3/21/2022,B3ZX22030416(C-YY2DB-220311-837)/FS220311-008L+009,Insole Board X20 FG #11046,Adidas,4,3
3/21/2022,B3ZX22030416(C-YY2DB-220311-837)/FS220311-008L+009,Insole Board X20 FG #11046,Adidas,10,3
3/21/2022,B3ZX22030416(C-YY2DB-220311-837)/FS220311-008L+009,Insole Board X20 FG #11046,Adidas,9.5,3
3/21/2022,B3ZX22030416(C-YY2DB-220311-837)/FS220311-008L+009,Insole Board X20 FG #11046,Adidas,5.5,3
3/21/2022,B3ZX22030416(C-YY2DB-220311-837)/FS220311-008L+009,Insole Board X20 FG #11046,Adidas,13,6
3/21/2022,B3ZX22030416(C-YY2DB-220311-837)/FS220311-008L+009,Insole Board X20 FG #11046,Adidas,10.5,3
3/21/2022,B3ZX22030416(C-YY2DB-220311-837)/FS220311-008L+009,Insole Board X20 FG #11046,Adidas,6.5,6
3/21/2022,B3ZX22030416(C-YY2DB-220311-837)/FS220311-008L+009,Insole Board X20 FG #11046,Adidas,7,3
3/21/2022,B3ZX22030416(C-YY2DB-220311-837)/FS220311-008L+009,Insole Board X20 FG #11046,Adidas,8.5,6
3/21/2022,B3ZX22030416(C-YY2DB-220311-837)/FS220311-008L+009,Insole Board X20 FG #11046,Adidas,6,3
3/21/2022,B3ZX22030416(C-YY2DB-220311-837)/FS220311-008L+009,Insole Board X20 FG #11046,Adidas,8,3
3/21/2022,B3ZX22030416(C-YY2DB-220311-837)/FS220311-008L+009,Insole Board X20 FG #11046,Adidas,11.5,3
3/21/2022,B3ZX22030416(C-YY2DB-220311-837)/FS220311-008L+009,Insole Board X20 FG #11046,Adidas,3.5,3
3/21/2022,B3ZX22030416(C-YY2DB-220311-837)/FS220311-008L+009,Insole Board X20 FG #11046,Adidas,7.5,3
3/21/2022,B3ZX22030416(C-YY2DB-220311-837)/FS220311-008L+009,Insole Board X20 FG #11046,Adidas,11,3
3/21/2022,B3ZX22030416(C-YY2DB-220311-837)/FS220311-008L+009,Insole Board X20 FG #11046,Adidas,9,3
3/21/2022,B3ZX22030416(C-YY2DB-220311-837)/FS220311-008L+009,Insole Board X20 FG #11046,Adidas,12.5,3
3/21/2022,B3ZX22030416(C-YY2DB-220311-837)/FS220311-008L+009,Insole Board X20 FG #11046,Adidas,12,3
3/21/2022,B3ZX22030416(C-YY2DB-220311-837)/FS220311-008L+009,Insole Board X20 FG #11046,Adidas,5,3
3/21/2022,B3ZX22030416(C-YY2DB-220311-837)/FS220311-008L+009,Insole Board X20 FG #11046,Adidas,4.5,3
3/21/2022,Sample ENR2203210010/ENR2203210011,Outsole Furon 3 FG #NSM-FFG02,NB,9.5-10,3
3/21/2022,Sample ENR2203210009,Outsole Furon 3(Take Down) FG J´s #NSJ-FFG02TD,NB,12K-12.5K,3
3/21/2022,Sample ENR2203210012,Outsole Furon 6 FG #PFG002,NB,9.5-10,3
3/21/2022,Sample AOS-FRVN-220321-02/CFM SS23,Outsole Generic NMZ/X P2/P3 MG Jr #21316,Adidas,2-2.5,13
3/21/2022,Sample AOS-FRVN-220321-02/CFM SS23,Outsole Generic NMZ/X P2/P3 MG Jr #21316,Adidas,2-2.5,13
3/21/2022,Sample AOS-FRVN-220321-01/sms SSA22006 SS23,Outsole #29184 AS1613,Adidas,7.5,12
3/21/2022,Sample ENR2203210007,Shank BB2WXYV3,NB,9.5-12,9
3/21/2022,SAMPLE: PT21120007PH,Shank Deviate 2 #JO1162,Puma,6-7,27
3/21/2022,SAMPLE: PT21120007PH,Shank Deviate 2 #JO1162,Puma,4.5-5.5,27
3/21/2022,SAMPLE: PT21120007PH,Shank Deviate 2 #JO1162,Puma,3-4,27
3/21/2022,SAMPLE: PT21120007PH,Shank Deviate 2 #JO1162,Puma,7.5-8.5,27
3/21/2022,Sample ENR2203210007,TPU BB2WXYV3,NB,M:9.5-10.5/W:11-12,5
3/19/2022,B3ZX22030549(C-YY2DB-220317-802)/PS220314-013T=>02,Insole Board X20 FG #11046,Adidas,8.5,73
3/19/2022,B3ZX22030549(C-YY2DB-220317-802)/PS220314-013T=>02,Insole Board X20 FG #11046,Adidas,6,19
3/19/2022,B3ZX22030549(C-YY2DB-220317-802)/PS220315-003D=>02,Insole Board X20 FG #11046,Adidas,8.5,144
3/19/2022,B3ZX22030549(C-YY2DB-220317-802)/PS220315-003D=>02,Insole Board X20 FG #11046,Adidas,6,22
3/19/2022,B3ZX22030549(C-YY2DB-220317-802)/PS220315-019V=>04,Insole Board X20 FG #11046,Adidas,8.5,89
3/19/2022,B3ZX22030549(C-YY2DB-220317-802)/PS220315-019V=>04,Insole Board X20 FG #11046,Adidas,6,21
3/19/2022,B3ZX22030549(C-YY2DB-220317-802)/PS220316-008D+010,Insole Board X20 FG #11046,Adidas,8.5,41
3/19/2022,VDM_2022-03-19,Outsole Evospeed 3+4 i SG#FB396,Puma,8-8.5,5
3/19/2022,VDM_2022/03/17,Outsole Future MxSG #FB1089,Puma,6.5,50
3/19/2022,VDM_2022/03/17,Outsole Future MxSG #FB1089,Puma,10,51
3/19/2022,VDM_2022/03/17,Outsole Future MxSG #FB1089,Puma,8,110
3/19/2022,VDM_2022/03/17,Outsole Future MxSG #FB1089,Puma,9.5,75
3/19/2022,VDM_2022/03/17,Outsole Future MxSG #FB1089,Puma,10.5,50
3/19/2022,VDM_2022/03/17,Outsole Future MxSG #FB1089,Puma,7.5,93
3/19/2022,VDM_2022/03/17,Outsole Future MxSG #FB1089,Puma,11,59
3/19/2022,VDM_2022/03/17,Outsole Future MxSG #FB1089,Puma,7,64
3/19/2022,VDM_2022/03/17,Outsole Future MxSG #FB1089,Puma,9,123
3/19/2022,VDM_2022/03/17,Outsole Future MxSG #FB1089,Puma,5.5,13
3/19/2022,VDM_2022/03/17,Outsole Future MxSG #FB1089,Puma,6,46
3/19/2022,VDM_2022/03/17,Outsole Future MxSG #FB1089,Puma,5,27
3/19/2022,VDM_2022/03/17,Outsole Future MxSG #FB1089,Puma,8.5,9
3/19/2022,VDM_2022/03/17,Outsole Future MxSG #FB1089,Puma,3.5,6
3/19/2022,VDM_2022/03/17,Outsole Future MxSG #FB1089,Puma,4.5,24
3/19/2022,VDM_2022/03/17,Outsole Future MxSG #FB1089,Puma,11.5,16
3/19/2022,VDM_2022/03/17,Outsole Future MxSG #FB1089,Puma,3,7
3/19/2022,VDM_2022/03/17,Outsole Future MxSG #FB1089,Puma,12,11
3/19/2022,VDM_2022/03/17,Outsole Future MxSG #FB1089,Puma,4,4
3/19/2022,VDM_2022/03/17,Outsole Future MxSG #FB1089,Puma,13,9
3/19/2022,VDM_2022-03-19,Outsole Future MxSG #FB1089,Puma,9,9
3/19/2022,VDM_2022/03/17,Outsole FW20 Puma Future 2.0 #FB1064,Puma,8,120
3/19/2022,VDM_2022/03/17,Outsole FW20 Puma Future 2.0 #FB1064,Puma,7.5,130
3/19/2022,VDM_2022/03/17,Outsole FW20 Puma Future 2.0 #FB1064,Puma,5.5,9
3/19/2022,VDM_2022/03/17,Outsole FW20 Puma Future 2.0 #FB1064,Puma,3.5,4
3/19/2022,VDM_2022/03/17,Outsole FW20 Puma Future 2.0 #FB1064,Puma,3,5
3/19/2022,VDM_2022/03/17,Outsole FW20 Puma Future 2.0 #FB1064,Puma,6,69
3/19/2022,VDM_2022/03/17,Outsole FW20 Puma Future 2.0 #FB1064,Puma,10.5,58
3/19/2022,VDM_2022/03/17,Outsole FW20 Puma Future 2.0 #FB1064,Puma,10,56
3/19/2022,VDM_2022/03/17,Outsole FW20 Puma Future 2.0 #FB1064,Puma,11.5,19
3/19/2022,VDM_2022/03/17,Outsole FW20 Puma Future 2.0 #FB1064,Puma,8.5,9
3/19/2022,VDM_2022/03/17,Outsole FW20 Puma Future 2.0 #FB1064,Puma,11,53
3/19/2022,VDM_2022/03/17,Outsole FW20 Puma Future 2.0 #FB1064,Puma,9.5,82
3/19/2022,VDM_2022/03/17,Outsole FW20 Puma Future 2.0 #FB1064,Puma,12,13
3/19/2022,VDM_2022/03/17,Outsole FW20 Puma Future 2.0 #FB1064,Puma,13,9
3/19/2022,VDM_2022/03/17,Outsole FW20 Puma Future 2.0 #FB1064,Puma,5,15
3/19/2022,VDM_2022/03/17,Outsole FW20 Puma Future 2.0 #FB1064,Puma,6.5,47
3/19/2022,VDM_2022/03/17,Outsole FW20 Puma Future 2.0 #FB1064,Puma,7,75
3/19/2022,VDM_2022/03/17,Outsole FW20 Puma Future 2.0 #FB1064,Puma,9,128
3/19/2022,VDM_2022/03/17,Outsole FW20 Puma Future 2.0 #FB1064,Puma,4.5,21
3/19/2022,VDM_2022-03-19,Outsole FW20 Puma Future 2.0 #FB1064,Puma,9,9
3/19/2022,VDM_2022-03-19,Outsole Game Changer Pro #FB1043,Puma,7.5,8
3/19/2022,VDM_2022-03-19,Outsole Game Changer SG#FB1044,Puma,7.5,7
3/19/2022,VDM_2022-03-19,Outsole Puma #FB1103,,7.5,20
3/19/2022,Sample AOS-FRVN-220319-01/PROMO FW22,Outsole Quickframe 2.0 #43685,,11,4
3/19/2022,B3ZX22030585(C-YY2DB-220318-821)/YK220317-006V,Torsion Bar Adizero Pro V2 #AD-52582,Adidas,8.5-9,8
3/18/2022,Sample ENR2203180003,Heel counter C 8-0114-M/W,NB,No.6(13-15),200
3/18/2022,Sample ENR2203180003,Heel counter C 8-0114-M/W,NB,No.3(7.5-9),200
3/18/2022,Sample ENR2203180005,Insole Board JV8-0425-1,NB,9.5,4
3/18/2022,B3ZX22030598(C-YY2DB-220318-834)/DS220304-011M,Insole Board X20 FG #11046,Adidas,8.5,3
3/18/2022,B3ZX22030599(C-YY2DB-220318-835)/FA220318-028U+029,Outsole Adizero LJ #AD-30569,Adidas,3-4,4
3/18/2022,B3ZX22030599(C-YY2DB-220318-835)/FA220318-028U+029,Outsole Adizero LJ #AD-30569,Adidas,6-7,6
3/18/2022,B3ZX22030599(C-YY2DB-220318-835)/FA220318-028U+029,Outsole Adizero LJ #AD-30569,Adidas,9-10,6
3/18/2022,B3ZX22030599(C-YY2DB-220318-835)/FA220318-028U+029,Outsole Adizero LJ #AD-30569,Adidas,13.5-14.5,3
3/18/2022,B3ZX22030599(C-YY2DB-220318-835)/FA220318-028U+029,Outsole Adizero LJ #AD-30569,Adidas,10.5-11.5,3
3/18/2022,B3ZX22030599(C-YY2DB-220318-835)/FA220318-028U+029,Outsole Adizero LJ #AD-30569,Adidas,12-13,2
3/18/2022,B3ZX22030599(C-YY2DB-220318-835)/FA220318-028U+029,Outsole Adizero LJ #AD-30569,Adidas,7.5-8.5,6
3/18/2022,B3ZX22030599(C-YY2DB-220318-835)/FA220318-028U+029,Outsole Adizero LJ #AD-30569,Adidas,4.5-5.5,3
3/18/2022,Sample ENR2203180004,Outsole Furon 6 FG #PFG002,NB,8.5-9,3
3/18/2022,VDM_2021/12/23,Outsole FW20 Puma Future 2.0 #FB1064,Puma,8.5,9
3/18/2022,SAMPLE: FRAVNB220008,Outsole FXG J’s#42146,Adidas,3-3.5,17
3/18/2022,B3ZX22030605(C-YY2DB-220318-841)/DS220318-004R,Outsole Quickframe 2.0 #43685,,11,1
3/18/2022,Sample ENR2203030012 ( giao kho PT) ( top ugent),Outsole Tekela 4 FG #PFG004,NB,4.5-5,6
3/18/2022,Sample ENR2203030012 ( giao kho PT) ( top ugent),Outsole Tekela 4 FG #PFG004,NB,10.5-11,8
3/18/2022,Sample ENR2203030012 ( giao kho PT) ( top ugent),Outsole Tekela 4 FG #PFG004,NB,9.5-10,8
3/18/2022,Sample ENR2203030012 ( giao kho PT) ( top ugent),Outsole Tekela 4 FG #PFG004,NB,5.5-6,6
3/18/2022,Sample ENR2203030012 ( giao kho PT) ( top ugent),Outsole Tekela 4 FG #PFG004,NB,8.5-9,10
3/18/2022,Sample ENR2203030012 ( giao kho PT) ( top ugent),Outsole Tekela 4 FG #PFG004,NB,7.5-8,8
3/18/2022,Sample ENR2203030012 ( giao kho PT) ( top ugent),Outsole Tekela 4 FG #PFG004,NB,11.5-12,8
3/18/2022,Sample ENR2203030012 ( giao kho PT) ( top ugent),Outsole Tekela 4 FG #PFG004,NB,12.5-13,6
3/18/2022,Sample ENR2203030012 ( giao kho PT) ( top ugent),Outsole Tekela 4 FG #PFG004,NB,6.5-7,6
3/18/2022,DEV REQUEST,Outsole Tekela HG #NSM-THG01,,9.5-10,10
3/18/2022,SAMPLE: FMVN-22031801,Outsole Ultra FG #FB1106 P3,Puma,8-8.5,15
3/18/2022,SAMPLE: FMVN-22031801,Outsole Ultra FG #FB1106 P3,Puma,8-8.5,15
3/18/2022,SAMPLE: FMVN-22031801,Outsole Ultra FG Jr #FB1107,Puma,3-3.5,15
3/18/2022,SAMPLE: FMVN-22031801,Outsole Ultra FG Jr #FB1107,Puma,3-3.5,15
3/18/2022,SAMPLE: FMVN-22031801,Outsole Ultra FG Jr #FB1107,Puma,3-3.5,15
3/18/2022,Claim sample FRVN220217-1=>4 (Urgent) /MCS FW22,Panel EQ19 RUN #55178,Adidas,5-5.5,25
3/18/2022,Claim sample FRVN220217-1=>4 (Urgent) /MCS FW22,Panel EQ19 RUN #55178,Adidas,5-5.5,25
3/18/2022,Claim sample FRVN220217-1=>4 (Urgent) /MCS FW22,Panel EQ19 RUN #55178,Adidas,5-5.5,25
3/18/2022,Claim sample FRVN211209-1=>3/MCS/TEST FW22 (2nd),Panel EQ19 RUN #55178,Adidas,5-5.5,25
3/18/2022,B3ZX22030585(C-YY2DB-220318-821)/CM220318-020C+021,Plate Velosamba #AD-45015,Adidas,8.5-9,9
3/18/2022,B3ZX22030585(C-YY2DB-220318-821)/CM220318-020C+021,Plate Velosamba #AD-45015,Adidas,8.5-9,9
3/18/2022,B3ZX22030585(C-YY2DB-220318-821)/CM220318-020C+021,Plate Velosamba #AD-45015,Adidas,8.5-9,9
3/18/2022,DEV REQUEST,Shank Hyperion Rocket,Brooks,9-9.5,7
3/18/2022,DEV REQUEST,Shank Hyperion Rocket,Brooks,9-9.5,7
3/18/2022,DEV REQUEST,Shank Hyperion Rocket,Brooks,9-9.5,7
3/18/2022,DEV REQUEST,Shank Hyperion Rocket,Brooks,9-9.5,7
3/18/2022,DEV REQUEST,Shank Hyperion Rocket,Brooks,9-9.5,7
3/18/2022,DEV REQUEST,Shank Hyperion Rocket,Brooks,9-9.5,7
3/18/2022,DEV REQUEST,Shank Hyperion Rocket,Brooks,9-9.5,7
3/18/2022,DEV REQUEST,Shank Hyperion Rocket,Brooks,9-9.5,7
3/18/2022,DEV REQUEST,Shank Hyperion Rocket,Brooks,9-9.5,7
3/18/2022,DEV REQUEST,Shank Hyperion Rocket,Brooks,9-9.5,7
3/18/2022,Sample GFRVN220310P136015-NB,Shank Propelv4 #PROPELV4,NB,M:6.5-7.5/W:8-9,15
3/18/2022,Sample GFRVN220310P136015-NB,Shank Propelv4 #PROPELV4,NB,M:5-6/W:6.5-7.5,15
3/18/2022,Sample GFRVN220310P136015-NB,Shank Propelv4 #PROPELV4,NB,M:9.5-10.5/W:11-12,22
3/18/2022,Sample GFRVN220310P136015-NB,Shank Propelv4 #PROPELV4,NB,M:11-12,10
3/18/2022,B3ZX22030585(C-YY2DB-220318-821)/DA220318-006K=>00,Torsion Bar Adizero Pro V2 #AD-52582,Adidas,8.5-9,4
3/17/2022,DEV REQUEST,Outsole #MB4040V7,NB,M's 9-9T/W's 10T-11,10
3/17/2022,Sample 8000029799/D-RON00035  CR2 remake SS23,Outsole Agility SG#42663,Adidas,8.5,3
3/17/2022,Sample ENR2203170001 ( TOP URGENT),Outsole ELMN8 V7 #40533,Brooks,3-3.5,5
3/17/2022,Sample VDM20220316-56-22,Outsole NB#MB3000V4,NB,10-10.5,7
3/17/2022,Sample VDM20220316-56-22,Outsole NB#MB3000V4,NB,10-10.5,7
3/17/2022,Sample VDM20220228-42-43; 44; 47,Outsole NB#MB3000V4,NB,9-9.5,1
3/17/2022,B3ZX22030550(C-YY2DB-220317-803)/DS220316-013S,Outsole Quickframe 2.0 #43685,,12,2
3/17/2022,B3ZX22030550(C-YY2DB-220317-803)/DA220316-010I,Torsion Bar Adizero Pro V2 #AD-52582,Adidas,8.5-9,2
3/17/2022,B3ZX22030550(C-YY2DB-220317-803)/AA220314-028I,Torsion Bar Adizero Pro V2 #AD-52582,Adidas,8.5-9,7
3/17/2022,B3ZX22030550(C-YY2DB-220317-803)/UA220316-001I,Torsion Bar Solar Boost #AD-47694,Adidas,5-6,4
3/17/2022,B3ZX22030550(C-YY2DB-220317-803)/UA220316-001I,Torsion Bar Solar Boost #AD-47694,Adidas,8-9,10
3/16/2022,Sample ENR2202080022,Insole Board JV8-0665 LH-2,NB,7.5-8,1
3/16/2022,Sample ENR2202080022,Insole Board JV8-0665 LH-2,NB,10.5-11,2
3/16/2022,Sample AOS-FRVN-220316-01/CR1 FW23,Outsole Generic NMZ/X P2/P3 MG Jr #21316,Adidas,3-3.5,10
3/16/2022,Sample AOS-FRVN-220316-01/CR1 FW23,Outsole Generic NMZ/X P2/P3 MG Jr #21316,Adidas,3-3.5,14
3/16/2022,Sample AOS-FRVN-220316-01/CR1 FW23,Outsole Generic NMZ/X P2/P3 MG Jr #21316,Adidas,3-3.5,11
3/16/2022,Sample VDM20220126-18-498==> 502,Outsole NB#MB3000V4,NB,6-6.5,6
3/15/2022,Sample 8000028346/DEV-LHC009 FC SMS SS23,Heel Counter C2005,Adidas,No.3(6.5-7.5),200
3/15/2022,Sample KMSS230304,Heel stabilizer Carbon Cat #MD1058,Puma,7.5-8.5,54
3/15/2022,Sample 8000029261/D-ROS10208 Remake CR2 SS23,Outsole Agility SG#42663,Adidas,8.5,2
3/15/2022,Sample 8000029261/D-ROS10229 Remake CR2 SS23,Outsole Agility SG#42663,Adidas,8.5,6
3/15/2022,Sample 8000029261/D-ROS10207 Remake CR2 SS23,Outsole Agility SG#42663,Adidas,8.5,3
3/15/2022,Sample AOS-FRVN-220315-01/cs1 looksee FW22,Outsole Game Mode United P2 FG #55188,Adidas,8.5-9,2
3/15/2022,Sample AOS-FRVN-220315-01/cs1 looksee FW22,Outsole GAMEMODE P2 FG Jr #55242,Adidas,3-3.5,2
3/15/2022,Sample 8000025789/D-ROS20177 CR2 SS23,Outsole Generic NMZ/X P2/P3 MG Jr #21316,Adidas,2-2.5,12
3/15/2022,DEV-NHI-2022-03-15,Pods Apos D2C,Apos,7.5,50
3/15/2022,Sample GFRVN220310P136014-NB,Shank Propelv4 #PROPELV4,NB,M:6.5-7.5/W:8-9,20
3/15/2022,Sample GFRVN220310P136014-NB,Shank Propelv4 #PROPELV4,NB,M:11-12,10
3/15/2022,SAMPLE: B3ZX22030494(C-YY2DB-220315-813)/UA220311-,Torsion Bar Adizero Pro V2 #AD-52582,Adidas,8.5-9,30
3/15/2022,SAMPLE: B3ZX22030494(C-YY2DB-220315-813)/UA220311-,Torsion Bar Adizero Pro V2 #AD-52582,Adidas,8.5-9,30
3/15/2022,B3ZX22030494(C-YY2DB-220315-813)/DA220214-010I,Torsion Bar Solar Boost #AD-47694,Adidas,8-9,2
3/15/2022,B3ZX22030494(C-YY2DB-220315-813)/CA220315-005I,Torsion Bar Solar Boost #AD-47694,Adidas,8-9,9
3/15/2022,Sample NSDO2200099/LK SS23,Torsion Bar Solar Prime #AD-44000,Adidas,8-9,9
3/15/2022,Sample ENR2203110002,TPU Lateral & Medial #BBKLV3,NB,13.5-15,7
3/15/2022,Sample ENR2203110002,TPU Lateral & Medial #BBKLV3,NB,13.5-15,7
3/15/2022,Sample ENR2203110002,TPU Lateral & Medial #BBKLV3,NB,11.5-13,17
3/14/2022,Sample FRVN220312-1=>3/SMS/MCS SS23,Heel Counter C4003R,Adidas,No.4(8-9),400
3/14/2022,Sample FRVN220312-1=>3/SMS/MCS SS23,Heel Counter C4003R,Adidas,No.2(5-6),200
3/14/2022,Sample FRVN220312-1=>3/SMS/MCS SS23,Heel counter C9004R,Adidas,No.3(10.5K-11.5K),600
3/14/2022,B3ZX22030448(C-YY2DB-220314-808)/,Outsole #31407,,11,1
3/14/2022,Sample VDM20220314-54-3; 4,Outsole NB#MB3000V4,NB,13,7
3/14/2022,Sample VDM20220314-54-3; 4,Outsole NB#MB3000V4,NB,13,7
3/14/2022,Sample NSDO2200087/MCS SS23,Torsion Bar Solar Prime #AD-44000,Adidas,8-9,20
3/14/2022,Sample NSDO2200095/LK SS23,Torsion Bar Solar Prime #AD-44000,Adidas,8-9,12
3/14/2022,DEV REQUEST,TPU Lateral & Medial #BBKLV3,NB,9.5-11,20
3/12/2022,A-FRA220312,Heelcap Ultra 4D #AD30832,Adidas,6.5-7.5,2
3/12/2022,A-FRA220312,Heelcap Ultra 4D #AD30832,Adidas,5-6,2
3/12/2022,A-FRA220312,Heelcap Ultra 4D #AD30832,Adidas,8-9,5
3/12/2022,A-FRA220312,Heelcap Ultra 4D #AD30832,Adidas,11-12,4
3/12/2022,A-FRA220312,Heelcap Ultra 4D #AD30832,Adidas,9.5-10.5,2
3/12/2022,Sample GFRVN220311P136016-NB,NB CR M/W574,NB,M:4-8.5/W:5.5-10,15
3/12/2022,FMVN-22031101,Outsole Future MG Jr #FB1096,Puma,3-3.5,10
3/12/2022,A-FRA220312,PANEL ULTRA 4D #AD30832,Adidas,6.5-7.5,5
3/12/2022,A-FRA220312,PANEL ULTRA 4D #AD30832,Adidas,8-9,11
3/12/2022,A-FRA220312,PANEL ULTRA 4D #AD30832,Adidas,5-6,5
3/12/2022,A-FRA220312,PANEL ULTRA 4D #AD30832,Adidas,9.5-10.5,5
3/12/2022,A-FRA220312,PANEL ULTRA 4D #AD30832,Adidas,11-12,10
3/11/2022,Sample ENR2203110004,Heel counter C 8-0114-M/W,NB,No.5(11.5-12.5),200
3/11/2022,Sample ENR2203110004,Heel counter C 8-0114-M/W,NB,No.4(9.5-11),1000
3/11/2022,Sample ENR2203110004,Heel counter C 8-0114-M/W,NB,No.6(13-15),200
3/11/2022,Sample ENR2203110004,Heel counter C 8-0114-M/W,NB,No.3(7.5-9),400
3/11/2022,Sample ENR2203110004,Heel counter C 8-0114-M/W,NB,No.2(5.5-7),800
3/11/2022,Sample ENR2203110004,Heel counter C 8-0114-M/W,NB,No.1(3.5-5),400
3/11/2022,B3ZX22010521(C-YY2DB-220127-801),Insole Board Eugen SP2 #60852,Adidas,10-10.5,3
3/11/2022,B3ZX22010521(C-YY2DB-220127-801),Insole Board Eugen SP2 #60852,Adidas,6-6.5,3
3/11/2022,B3ZX22030100(C-YY2DB-220303-810)/DA220302-142Y,Insole Board Eugen SP2 #60852,Adidas,9-9.5,1
3/11/2022,B3ZX22030267(C-YY2DB-220309-805)/PA220308-024Y,Insole Board Eugen SP2 #60852,Adidas,9-9.5,4
3/11/2022,Sample VDM20220311-52-1 ( TOP URGENT),Outsole #MB4040V7,NB,M's 9-9T/W's 10T-11,4
3/11/2022,SAMPLE: B3ZX22030382(C-YY2DB-220311-803)/PA220309-,Outsole Adizero LJ #AD-30569,Adidas,9-10,5
3/11/2022,B3ZX22010521(C-YY2DB-220127-801),Outsole Eugen SP2 #60852,Adidas,6-6.5,3
3/11/2022,B3ZX22010521(C-YY2DB-220127-801),Outsole Eugen SP2 #60852,Adidas,10-10.5,3
3/11/2022,B3ZX22030100(C-YY2DB-220303-810)/DA220302-142Y,Outsole Eugen SP2 #60852,Adidas,9-9.5,1
3/11/2022,B3ZX22030267(C-YY2DB-220309-805)/PA220308-024Y,Outsole Eugen SP2 #60852,Adidas,9-9.5,5
3/11/2022,Sample ENR2202080023 ( CLAIM),Outsole Furon 6 FG #PFG002,NB,7.5-8,1
3/11/2022,Sample AOS-FRVN-220310-01/SMS SSA22007 SS23,Outsole Game Mode United P2 FG #55188,Adidas,8.5-9,11
3/11/2022,Sample AOS-FRVN-220310-01/SMS SSA22007 SS23,Outsole Game Mode United P2 FG #55188,Adidas,8.5-9,9
3/11/2022,Sample AOS-FRVN-220310-01/SMS SSA22007 SS23,Outsole Game Mode United P2 FG #55188,Adidas,8.5-9,9
3/11/2022,Sample AOS-FRVN-220310-01/SMS SSA22007 SS23,Outsole GAMEMODE P2 FG Jr #55242,Adidas,3-3.5,9
3/11/2022,Sample AOS-FRVN-220310-01/SMS SSA22007 SS23,Outsole GAMEMODE P2 FG Jr #55242,Adidas,3-3.5,4
3/11/2022,Sample AOS-FRVN-220310-01/SMS SSA22007 SS23,Outsole GAMEMODE P2 FG Jr #55242,Adidas,3-3.5,4
3/11/2022,Sample AOS-FRVN-220310-01/SMS SSA22007 SS23,Outsole GAMEMODE P2 FG Jr #55242,Adidas,3-3.5,9
3/11/2022,Sample AOS-FRVN-220310-01/SMS SSA22007 SS23,Outsole GAMEMODE P2 FG Jr #55242,Adidas,3-3.5,4
3/11/2022,Sample AOS-FRVN-220310-01/SMS SSA22007 SS23,Outsole GAMEMODE P2 FG Jr #55242,Adidas,3-3.5,4
3/11/2022,Sample AOS-FRVN-220310-01/SMS SSA22007 SS23,Outsole GAMEMODE P2 FG Jr #55242,Adidas,10K-10.5K,4
3/11/2022,Sample AOS-FRVN-220310-01/SMS SSA22007 SS23,Outsole GAMEMODE P2 FG Jr #55242,Adidas,3-3.5,11
3/11/2022,Sample AOS-FRVN-220310-01/SMS SSA22007 SS23,Outsole GAMEMODE P2 FG Jr #55242,Adidas,11K-11.5K,4
3/11/2022,Sample AOS-FRVN-220310-01/SMS SSA22007 SS23,Outsole GAMEMODE P2 FG Jr #55242,Adidas,3-3.5,4
3/11/2022,Sample AOS-FRVN-220310-01/SMS SSA22007 SS23,Outsole GAMEMODE P2 FG Jr #55242,Adidas,10K-10.5K,4
3/11/2022,Sample AOS-FRVN-220310-01/SMS SSA22007 SS23,Outsole GAMEMODE P2 FG Jr #55242,Adidas,3-3.5,4
3/11/2022,Sample AOS-FRVN-220310-01/SMS SSA22007 SS23,Outsole GAMEMODE P2 FG Jr #55242,Adidas,12K-12.5K,4
3/11/2022,Sample AOS-FRVN-220310-01/SMS SSA22007 SS23,Outsole GAMEMODE P2 FG Jr #55242,Adidas,11K-11.5K,4
3/11/2022,SAMPLE: B3ZX22030382(C-YY2DB-220311-803)/PA220308-,Outsole Olympic Plate #AD-06636,,8-8.5,5
3/11/2022,SAMPLE: B3ZX22030382(C-YY2DB-220311-803)/PA220308-,Outsole Olympic Plate #AD-06636,,8-8.5,5
3/11/2022,SAMPLE: B3ZX22030382(C-YY2DB-220311-803)/PA220309-,Outsole Plate Sprint Star #AD-39902,Adidas,8-8.5,5
3/11/2022,SAMPLE: B3ZX22030382(C-YY2DB-220311-803)/PA220309-,Outsole Plate Sprint Star #AD-39902,Adidas,8-8.5,5
3/11/2022,SAMPLE: B3ZX22030382(C-YY2DB-220311-803)/PA220309-,Outsole Plate Sprint Star #AD-39902,Adidas,8-8.5,5
3/11/2022,SAMPLE: VDM_2022/03/11,Outsole Puma #FB1103,,7.5,7
3/11/2022,SAMPLE: VDM_2022/03/11,Outsole Puma #FB1103,,7.5,7
3/11/2022,Sample GFRVN220310P136014-NB,Shank Propelv4 #PROPELV4,NB,M:5-6/W:6.5-7.5,10
3/11/2022,Sample GFRVN220310P136014-NB,Shank Propelv4 #PROPELV4,NB,M:9.5-10.5/W:11-12,20
3/11/2022,C-YY2SF -220228-055,Torsion Bar (Rod) AVANTI 25 #AD-56677,Adidas,8.5-9.5,212
3/11/2022,C-YY2SF -220228-055,Torsion Bar (Rod) AVANTI 25 #AD-56677,Adidas,7-8,105
3/11/2022,C-YY2SF -220228-055,Torsion Bar (Rod) AVANTI 25 #AD-56677,Adidas,5.5-6.5,17
3/11/2022,C-YY2SF -220228-055,Torsion Bar (Rod) AVANTI 25 #AD-56677,Adidas,4-5,1
3/11/2022,B3ZX22030334(C-YY2DB-220310-820)/PA220309-058Q,Torsion Bar Adizero Pro V2 #AD-52582,Adidas,9.5-10,2
3/10/2022,A-FRA220310,Heelcap Ultra 4D #AD30832,Adidas,8-9,6
3/10/2022,B3ZX22030334(C-YY2DB-220310-820)/PA220309-058Q,Midsole Blades Adizero SUB 2 #AD-53755,Adidas,9.5-10.5,2
3/10/2022,A-FRA220310,Midsole Shift #61086,Adidas,8.5,20
3/10/2022,A-FRA220310,Midsole Shift #61086,Adidas,8.5,20
3/10/2022,A-FRA220310,Midsole Shift #61086,Adidas,8.5,50
3/10/2022,A-FRA220310,Midsole Shift #61086,Adidas,5.5,30
3/10/2022,A-FRA220310,Midsole Shift #61086,Adidas,5.5,40
3/10/2022,A-FRA220310,Midsole Shift #61086,Adidas,8.5,50
3/10/2022,A-FRA220310,Midsole Shift #61086,Adidas,5.5,50
3/10/2022,Sample GFRVN220221P136008-NB,NB CR M/W574,NB,M:4-8.5/W:5.5-10,10
3/10/2022,Sample GFRVN220221P136008-NB,NB CR M/W574,NB,M:4-8.5/W:5.5-10,10
3/10/2022,DEV REQUEST,NB CR M/W574,NB,M:4-8.5/W:5.5-10,10
3/10/2022,DEV REQUEST,NB CR M/W574,NB,M:4-8.5/W:5.5-10,10
3/10/2022,DEV REQUEST,NB CR M/W574,NB,M:4-8.5/W:5.5-10,10
3/10/2022,DEV REQUEST,NB CR M/W574,NB,M:4-8.5/W:5.5-10,10
3/10/2022,DEV REQUEST,NB CR M/W574,NB,M:4-8.5/W:5.5-10,10
3/10/2022,DEV REQUEST,NB CR M/W574,NB,M:4-8.5/W:5.5-10,10
3/10/2022,DEV REQUEST,NB CR M/W574,NB,M:4-8.5/W:5.5-10,10
3/10/2022,DEV REQUEST,NB CR M/W574,NB,M:4-8.5/W:5.5-10,10
3/10/2022,DEV REQUEST,NB CR M/W574,NB,M:4-8.5/W:5.5-10,10
3/10/2022,DEV REQUEST,NB CR M/W574,NB,M:4-8.5/W:5.5-10,10
3/10/2022,DEV REQUEST,NB CR M/W574,NB,M:4-8.5/W:5.5-10,10
3/10/2022,DEV REQUEST,NB CR M/W574,NB,M:4-8.5/W:5.5-10,10
3/10/2022,DEV REQUEST,NB CR M/W574,NB,M:4-8.5/W:5.5-10,10
3/10/2022,DEV REQUEST,NB CR M/W574,NB,M:4-8.5/W:5.5-10,10
3/10/2022,DEV REQUEST,NB CR M/W574,NB,M:4-8.5/W:5.5-10,10
3/10/2022,DEV REQUEST,NB CR M/W574,NB,M:4-8.5/W:5.5-10,10
3/10/2022,DEV REQUEST,NB CR M/W574,NB,M:4-8.5/W:5.5-10,10
3/10/2022,DEV REQUEST,NB CR M/W574,NB,M:4-8.5/W:5.5-10,10
3/10/2022,DEV REQUEST,NB CR M/W574,NB,M:4-8.5/W:5.5-10,10
3/10/2022,DEV REQUEST,NB CR M/W574,NB,M:4-8.5/W:5.5-10,10
3/10/2022,DEV REQUEST,NB CR M/W574,NB,M:4-8.5/W:5.5-10,10
3/10/2022,DEV REQUEST,NB CR M/W574,NB,M:4-8.5/W:5.5-10,10
3/10/2022,DEV REQUEST,NB CR M/W574,NB,M:4-8.5/W:5.5-10,10
3/10/2022,DEV REQUEST,NB CR M/W574,NB,M:4-8.5/W:5.5-10,10
3/10/2022,DEV REQUEST,NB CR M/W574,NB,M:4-8.5/W:5.5-10,10
3/10/2022,DEV REQUEST,NB CR M/W574,NB,M:4-8.5/W:5.5-10,10
3/10/2022,DEV REQUEST,NB CR M/W574,NB,M:4-8.5/W:5.5-10,10
3/10/2022,DEV REQUEST,NB CR M/W574,NB,M:4-8.5/W:5.5-10,10
3/10/2022,DEV REQUEST,NB CR M/W574,NB,M:4-8.5/W:5.5-10,10
3/10/2022,DEV REQUEST,NB CR M/W574,NB,M:4-8.5/W:5.5-10,10
3/10/2022,DEV REQUEST,NB CR M/W574,NB,M:4-8.5/W:5.5-10,10
3/10/2022,DEV REQUEST,NB CR M/W574,NB,M:4-8.5/W:5.5-10,10
3/10/2022,DEV REQUEST,NB CR M/W574,NB,M:4-8.5/W:5.5-10,10
3/10/2022,DEV REQUEST,NB CR M/W574,NB,M:4-8.5/W:5.5-10,10
3/10/2022,DEV REQUEST,NB CR M/W574,NB,M:4-8.5/W:5.5-10,10
3/10/2022,DEV REQUEST,NB CR M/W574,NB,M:4-8.5/W:5.5-10,10
3/10/2022,DEV REQUEST,NB CR M/W574,NB,M:4-8.5/W:5.5-10,10
3/10/2022,DEV REQUEST,NB CR M/W574,NB,M:4-8.5/W:5.5-10,10
3/10/2022,DEV-LIEU-2022-03-10,Outsole evoSPEED 360.5 FG#FB1010,Puma,8-8.5,5
3/10/2022,DEV-LIEU-2022-03-10,Outsole evoSPEED 360.5 FG#FB1010,Puma,8-8.5,5
3/10/2022,SAMPLE:  FMVN-21092202,Outsole Pace Mx SG.1.2 #FB1066,Puma,8.5,3
3/10/2022,SAMPLE:  FMVN-21092202,Outsole Pace Mx SG.1.2 #FB1066,Puma,7.5,13
3/10/2022,SAMPLE:  FMVN-21092202,Outsole Puma PACE #FB1065,Puma,8.5,20
3/10/2022,Sample ENR220310001,Outsole Tekela HG #NSM-THG01,,9.5-10,4
3/10/2022,SAMPLE: 80087545+80087673,Outsole Ultra FG #FB1106 P3,Puma,8-8.5,20
3/10/2022,SAMPLE: 80087545+80087673,Outsole Ultra FG #FB1106 P3,Puma,8-8.5,20
3/10/2022,SAMPLE: 80087545+80087673,Outsole Ultra FG #FB1106 P3,Puma,8-8.5,20
3/10/2022,SAMPLE: 80087545+80087673,Outsole Ultra FG #FB1106 P3,Puma,8-8.5,20
3/10/2022,SAMPLE: 80087545+80087673,Outsole Ultra FG Jr #FB1107,Puma,3-3.5,20
3/10/2022,SAMPLE: 80087545+80087673,Outsole Ultra FG Jr #FB1107,Puma,3-3.5,20
3/10/2022,A-FRA220310,PANEL ULTRA 4D #AD30832,Adidas,8-9,6
3/10/2022,SAMPLE: B3ZX22030228(C-YY2DB-220308-804)/AM220304-,Plate Velosamba #AD-45015,Adidas,8.5-9,5
3/10/2022,B3ZX22030334(C-YY2DB-220310-820)/PA220309-058Q,Shank (Rod) Adizero SUB 2 #AD-53755,Adidas,9.5-10.5,2
3/10/2022,SAMPLE: B3ZX22030228(C-YY2DB-220308-804)/YK220307-,Torsion Bar Solar Boost #AD-47694,Adidas,5-6,7
3/10/2022,SAMPLE: B3ZX22030228(C-YY2DB-220308-804)/YK220307-,Torsion Bar Solar Boost #AD-47694,Adidas,8-9,4
3/10/2022,SAMPLE: B3ZX22030228(C-YY2DB-220308-804)/IK220307-,Torsion Bar Solar Boost #AD-47694,Adidas,8-9,15
3/9/2022,SAMPLE: FRAVNU220006+07,Heel Counter C4003R,Adidas,No.4(8-9),400
3/9/2022,SAMPLE: FRAVNU220006+07,Heel Counter C4003R,Adidas,No.5(9.5-10.5),200
3/9/2022,SAMPLE: FRAVNU220006+07,Heel Counter C4003R,Adidas,No.3(6.5-7.5),200
3/9/2022,SAMPLE: FRAVNU220006+07,Heel Counter C4003R,Adidas,No.2(5-6),400
3/9/2022,SAMPLE: A-FRA220308,Heelcap Ultra 4D #AD30832,Adidas,8-9,8
3/9/2022,Sample VDM2022 0307-48-19;20;21,Insole Board Speed Board Dual Density #ON048,,9.5,1
3/9/2022,Sample VDM2022 0307-48-19;20;21,Insole Board Speed Board Dual Density #ON048,,9.5,1
3/9/2022,Sample VDM2022 0307-48-19;20;21,Insole Board Speed Board Dual Density #ON048,,9.5,1
3/9/2022,SAMPLE: A-FRA220307,Midsole Shift #61086,Adidas,8.5,30
3/9/2022,SAMPLE: B3ZX22030267(C-YY2DB-220309-805)/AA220308-,Outsole Adizero LJ #AD-30569,Adidas,9-10,1
3/9/2022,VDM_2022/02/19,Outsole Future MG #FB1095,Puma,8-8.5,13
3/9/2022,FMVN-22012204,Outsole Future MG Jr #FB1096,Puma,3-3.5,15
3/9/2022,FMVN-22012204,Outsole Future MG Jr #FB1096,Puma,3-3.5,78
3/9/2022,VDM_2022/02/19,Outsole Future MG Jr #FB1096,Puma,3-3.5,44
3/9/2022,SAMPLE:  FMVN-21092202,Outsole Puma PACE #FB1065,Puma,9.5,45
3/9/2022,SAMPLE: A-FRA220304,Panel EQ19 RUN #55178,Adidas,8-8.5,21
3/9/2022,SAMPLE: A-FRA220304,Panel EQ19 RUN #55178,Adidas,8-8.5,21
3/9/2022,SAMPLE: A-FRA220304,Panel EQ19 RUN #55178,Adidas,5-5.5,20
3/9/2022,SAMPLE: A-FRA220304,Panel EQ19 RUN #55178,Adidas,8-8.5,22
3/9/2022,SAMPLE: A-FRA220304,Panel EQ19 RUN #55178,Adidas,5-5.5,50
3/9/2022,SAMPLE: A-FRA220304,Panel EQ19 RUN #55178,Adidas,8-8.5,20
3/9/2022,SAMPLE: A-FRA220304,Panel EQ19 RUN #55178,Adidas,5-5.5,45
3/9/2022,SAMPLE: A-FRA220304,Panel EQ19 RUN #55178,Adidas,8-8.5,20
3/9/2022,SAMPLE: A-FRA220304,Panel EQ19 RUN #55178,Adidas,5-5.5,20
3/9/2022,SAMPLE: A-FRA220304,Panel EQ19 RUN #55178,Adidas,8-8.5,20
3/9/2022,SAMPLE: A-FRA220308,PANEL ULTRA 4D #AD30832,Adidas,8-9,12
3/9/2022,FRA220212,PANEL ULTRA 4D #AD30832,Adidas,8-9,12
3/9/2022,SAMPLE: PT22020003PH,Shank Deviate 2 #JO1162,Puma,6-7,27
3/9/2022,SAMPLE: PT22020003PH,Shank Deviate 2 #JO1162,Puma,9-10,27
3/9/2022,SAMPLE: PT22020003PH,Shank Deviate 2 #JO1162,Puma,13.5-14.5,9
3/9/2022,SAMPLE: PT22020003PH,Shank Deviate 2 #JO1162,Puma,7.5-8.5,27
3/9/2022,SAMPLE: PT22020003PH,Shank Deviate 2 #JO1162,Puma,12-13,18
3/9/2022,SAMPLE: PT22020003PH,Shank Deviate 2 #JO1162,Puma,10.5-11.5,18
3/9/2022,SAMPLE: B3ZX22030228(C-YY2DB-220308-804)/DA220307-,Torsion Bar Adizero Pro V2 #AD-52582,Adidas,8.5-9,1
3/9/2022,SAMPLE: FRAVNB220006+07,Torsion Bar Adizero Pro V2 #AD-52582,Adidas,8.5-9,20
3/8/2022,SAMPLE: FMVN-22030201,Heel Counter TS030,Puma,No.4(7.5-8.5),129
3/8/2022,SAMPLE: FMVN-22030201,Heel Counter TS030,Puma,No.6(10.5-11.5),39
3/8/2022,SAMPLE: FMVN-22030201,Heel Counter TS030,Puma,No.5(9-10),80
3/8/2022,SAMPLE: FMVN-22030201,Heel Counter TS030,Puma,No.1(3-4),40
3/8/2022,SAMPLE: FMVN-22030201,Heel Counter TS030,Puma,No.7(12-13),26
3/8/2022,SAMPLE: FMVN-22030201,Heel Counter TS030,Puma,No.2(4.5-5.5),30
3/8/2022,SAMPLE: FMVN-22030201,Heel Counter TS030,Puma,No.3(6-7),59
3/8/2022,Sample LAN220307-006-FRAMAS /PHOTO+CFM SS23,Heel stabilizer Carbon Cat #MD1058,Puma,7.5-8.5,50
3/8/2022,DEV REQUEST,NB CR M/W574,NB,M:4-8.5/W:5.5-10,20
3/8/2022,YIIY000152FC/C-YY2DA     -220307-027,Outsole Adizero TJ #AD-30571,Adidas,7.5-8.5,33
3/8/2022,Sample 8000026303/D-ROS10208 FC SMS SS23,Outsole Agility SG#42663,Adidas,8.5,5
3/8/2022,Sample 8000026303/D-ROS10229 FC SMS SS23,Outsole Agility SG#42663,Adidas,8.5,13
3/8/2022,Sample ENR2203080007/ENR2203080006,Outsole Furon 6 FG #PFG002,NB,9.5-10,3
3/8/2022,Sample ENR2203080007/ENR2203080006,Outsole Furon 6 FG #PFG002,NB,9.5-10,1
3/8/2022,Sample ENR2203080007/ENR2203080006,Outsole Furon 6 FG #PFG002,NB,7.5-8,3
3/8/2022,Sample ENR2203080007/ENR2203080006,Outsole Furon 6 FG #PFG002,NB,10.5-11,4
3/8/2022,Sample 6000037315/HQ3961/S2T FW22 2nd,Outsole Originals Stan Smith Loop #AD-56914,Adidas,10.5,25
3/8/2022,Sample 6000037315/HQ3961/S2T FW22 2nd,Outsole Originals Stan Smith Loop #AD-56914,Adidas,9.5,25
3/8/2022,Sample 6000037315/HQ3961/S2T FW22 2nd,Outsole Originals Stan Smith Loop #AD-56914,Adidas,8.5,1
3/8/2022,Sample 6000037315/HQ3961/S2T FW22 2nd,Outsole Originals Stan Smith Loop #AD-56914,Adidas,5.5,25
3/8/2022,Sample 6000037315/HQ3961/S2T FW22 2nd,Outsole Originals Stan Smith Loop #AD-56914,Adidas,6.5,25
3/8/2022,Sample 6000037315/HQ3961/S2T FW22 2nd,Outsole Originals Stan Smith Loop #AD-56914,Adidas,11.5,25
3/8/2022,Sample 6000037315/HQ3961/S2T FW22 2nd,Outsole Originals Stan Smith Loop #AD-56914,Adidas,13.5,15
3/8/2022,Sample 6000037315/HQ3961/S2T FW22 2nd,Outsole Originals Stan Smith Loop #AD-56914,Adidas,7.5,25
3/8/2022,Sample 6000037315/HQ3961/S2T FW22 2nd,Outsole Originals Stan Smith Loop #AD-56914,Adidas,12.5,15
3/8/2022,Sample 6000037315/HQ3961/S2T FW22 2nd,Outsole Originals Stan Smith Loop #AD-56914,Adidas,4.5,25
3/8/2022,DEV REQUEST,Outsole Tekela 4 FG #PFG004,NB,10.5-11,50
3/8/2022,Sample TAX-LY20220301769/J030029867 MCS FW22,Shank insert Yeezy Boost 350V2 #AD-927,Adidas,11.5,3
3/8/2022,Sample TAX-LY20220301769/J030029867 MCS FW22,Shank insert Yeezy Boost 350V2 #AD-927,Adidas,8.5,3
3/7/2022,FRA211227,Heelcap Ultra 4D #AD30832,Adidas,8-9,15
3/7/2022,SAMPLE: B3ZX22030173(C-YY2DB-220304-828)/DS220304-,Insole Board X20 FG #11046,Adidas,8.5,6
3/7/2022,SAMPLE: B3ZX22030173(C-YY2DB-220304-828)/DS220304-,Insole Board X20 FG #11046,Adidas,8.5,3
3/7/2022,SAMPLE: B3ZX22030173(C-YY2DB-220304-828)/DS220304-,Insole Board X20 FG #11046,Adidas,8.5,3
3/7/2022,SAMPLE: B3ZX22030173(C-YY2DB-220304-828)/DS220304-,Insole Board X20 FG #11046,Adidas,8.5,6
3/7/2022,SAMPLE: PUMA_2022/03/07,Outsole Future MG #FB1095,Puma,10-10.5,4
3/7/2022,SAMPLE: PUMA_2022/03/07,Outsole Future MG #FB1095,Puma,6-6.5,4
3/7/2022,SAMPLE: PUMA_2022/03/07,Outsole Future MG #FB1095,Puma,8-8.5,4
3/7/2022,SAMPLE: PUMA_2022/03/07,Outsole FW20 Puma Future 2.0 #FB1064,Puma,8,5
3/7/2022,Sample ENR2203030012 ( giao kho PT),Outsole Tekela 4 FG #PFG004,NB,9.5-10,8
3/7/2022,Sample ENR2203030012 ( giao kho PT),Outsole Tekela 4 FG #PFG004,NB,10.5-11,8
3/7/2022,Sample ENR2203030012 ( giao kho PT),Outsole Tekela 4 FG #PFG004,NB,4.5-5,6
3/7/2022,Sample ENR2203030012 ( giao kho PT),Outsole Tekela 4 FG #PFG004,NB,5.5-6,6
3/7/2022,Sample ENR2203030012 ( giao kho PT),Outsole Tekela 4 FG #PFG004,NB,8.5-9,10
3/7/2022,Sample ENR2203030012 ( giao kho PT),Outsole Tekela 4 FG #PFG004,NB,7.5-8,8
3/7/2022,Sample ENR2203030012 ( giao kho PT),Outsole Tekela 4 FG #PFG004,NB,6.5-7,6
3/7/2022,Sample ENR2203030012 ( giao kho PT),Outsole Tekela 4 FG #PFG004,NB,12.5-13,6
3/7/2022,Sample ENR2203030012 ( giao kho PT),Outsole Tekela 4 FG #PFG004,NB,11.5-12,8
3/7/2022,SAMPLE: FMVN-22021001-3,Outsole Ultra FG #FB1106 P4,Puma,8-8.5,5
3/7/2022,FRA211227,PANEL ULTRA 4D #AD30832,Adidas,8-9,15
3/7/2022,SAMPLE: FMPC20220304-1,Shank Deviate 2 #JO1162,Puma,7.5-8.5,25
3/7/2022,SAMPLE: B3ZX22030046(C-YY2DB-220302-806)/AK220301-,Torsion Bar Solar Boost #AD-47694,Adidas,8-9,1
3/7/2022,SAMPLE: B3ZX22030182(C-YY2DB-220307-802),Torsion Bar Solar Boost #AD-47694,Adidas,5-6,9
3/7/2022,SAMPLE: B3ZX22030182(C-YY2DB-220307-802)/CA220223-,Torsion Bar Solar Boost #AD-47694,Adidas,8-9,9
3/7/2022,Sample ENR2203050001,TPU Lateral & Medial #BBKLV3,NB,9.5-11,33
3/7/2022,Sample ENR2203050001,TPU Lateral & Medial #BBKLV3,NB,9.5-11,33
3/5/2022,Sample FRAMAS-SS23-0403-MCS-AD/CR2 SS23,Banadage MTBR Adilette #61679,Adidas,9,35
3/5/2022,TAX-LY20220300592,Heel Counter C4003R,Adidas,No.2(5-6),57
3/5/2022,TAX-LY20220300828,Heel Counter C4003R,Adidas,No.2(5-6),228
3/5/2022,Sample PRB20220304/FC SMS SS23,Outsole Agility SG#42663,Adidas,8.5,5
3/5/2022,Sample PRB20220304/FC SMS SS23,Outsole Agility SG#42663,Adidas,8.5,13
3/5/2022,Sample PRB20220304/FC SMS SS23,Outsole Agility SG#42663,Adidas,8.5,4
3/5/2022,Sample FRAMAS-SS23-0403-MCS-AD/CR2 SS23,Outsole MTBR Adilette #61681,Adidas,9,35
3/4/2022,Sample AOS-FRVN-211119-01/CS2/CS3 Internal officia,Heelcap Lego Vintro Boot C #59052-HC,Adidas,10K-10.5K/2.5K-3.5K,21
3/4/2022,Sample AOS-FRVN-211119-01/CS2/CS3 Internal officia,Heelcap Lego Vintro Boot C #59052-HC,Adidas,11K-12K/12.5K-13.5K,36
3/4/2022,Sample AOS-FRVN-211119-01/CS2/CS3 Internal officia,Heelcap Lego Vintro Boot I #58810-HC,Adidas,4.5K-5.5K/6K-7K,31
3/4/2022,Sample AOS-FRVN-211119-01/CS2/CS3 Internal officia,Heelcap Lego Vintro Boot I #58810-HC,Adidas,3K-4K/9K-9.5K,32
3/4/2022,SAMPLE ENR2203030004,Outsole Furon 3 FG #NSM-FFG02,NB,9.5-10,1
3/4/2022,SAMPLE ENR2203030009/ENR2203030011,Outsole Furon 6 FG #PFG002,NB,9.5-10,3
3/4/2022,SAMPLE ENR2203030009/ENR2203030011,Outsole Tekela 4 FG #PFG004,NB,9.5-10,3
3/4/2022,SAMPLE ENR2203030005/ENR2203030007,Outsole Tekela FG #NSM-TFG01,NB,9.5-10,6
3/4/2022,Sample AOS-FRVN-211119-01/CS2/CS3 Internal officia,Puller Lego Vintro Boot C #59052-PU,Adidas,10K-12.5K/13K-2.5,78
3/4/2022,Sample AOS-FRVN-211119-01/CS2/CS3 Internal officia,Puller Lego Vintro Boot I #58810-PU,Adidas,3K-6.5K/7K-9.5K,84
3/4/2022,sample ENR2203040011,Shank BB2WXYV3,NB,3.5-6,4
3/4/2022,SAMPLE: FRAVNB210044,Torsion Bar Solar boost Glide ST #AD-32573,Adidas,5-6,2
3/4/2022,YIIL057961FV/C-TG2S4     -220303-031,TPU Upper single density Ultra boost ST #AD-39031SD,,3.5-4.5,10
3/4/2022,YIIL057961FV/C-TG2S4     -220303-031,TPU Upper single density Ultra boost ST #AD-39031SD,,9.5-10.5,8
3/4/2022,YIIL057961FV/C-TG2S4     -220303-031,TPU Upper single density Ultra boost ST #AD-39031SD,,8-9,8
3/4/2022,YIIL057961FV/C-TG2S4     -220303-031,TPU Upper single density Ultra boost ST #AD-39031SD,,12.5-13.5,6
3/4/2022,YIIL057961FV/C-TG2S4     -220303-031,TPU Upper single density Ultra boost ST #AD-39031SD,,6.5-7.5,8
3/4/2022,YIIL057961FV/C-TG2S4     -220303-031,TPU Upper single density Ultra boost ST #AD-39031SD,,5-6,20
3/4/2022,YIIL057961FV/C-TG2S4     -220303-031,TPU Upper single density Ultra boost ST #AD-39031SD,,11-12,8
3/3/2022,DEV-TAI-2022-03-03,Foot bed Climacool Vento #54551,Adidas,6-6.5,40
3/3/2022,SAMPLE: B3ZX22020443(C-YY2DB-220225-810)/CA220224-,Outsole Adizero LJ #AD-30569,Adidas,9-10,9
3/3/2022,SAMPLE: B3ZX22020443(C-YY2DB-220225-810)/IA220224-,Outsole Adizero LJ #AD-30569,Adidas,9-10,26
3/3/2022,SAMPLE: B3ZX22020394?C-YY2DB-220224-808?/CA220222-,Outsole Adizero TJ #AD-30571,Adidas,7.5-8.5,9
3/3/2022,Sample ENR2202280024,Outsole AG02 #NSM-AG02(TD),NB,9.5-10,3
3/3/2022,Sample 8000025789/D-ROS70066 CR2 SS23,Outsole Generic NMZ/X P2/P3 MG Jr #21316,Adidas,3-3.5,2
3/3/2022,SAMPLE: YIIW003436FC(C-Y2SWM-220117-002),Outsole Olympic Plate #AD-06636,,8-8.5,3
3/3/2022,SAMPLE: YIIW003436FC(C-Y2SWM-220117-002),Outsole Olympic Plate #AD-06636,,8-8.5,3
3/3/2022,Sample 6000037315/HQ3961/S2T FW22,Outsole Originals Stan Smith Loop #AD-56914,Adidas,10.5,25
3/3/2022,Sample 6000037315/HQ3961/S2T FW22,Outsole Originals Stan Smith Loop #AD-56914,Adidas,8.5,1
3/3/2022,Sample 6000037315/HQ3961/S2T FW22,Outsole Originals Stan Smith Loop #AD-56914,Adidas,9.5,25
3/3/2022,Sample 6000037315/HQ3961/S2T FW22,Outsole Originals Stan Smith Loop #AD-56914,Adidas,6.5,25
3/3/2022,Sample 6000037315/HQ3961/S2T FW22,Outsole Originals Stan Smith Loop #AD-56914,Adidas,11.5,25
3/3/2022,Sample 6000037315/HQ3961/S2T FW22,Outsole Originals Stan Smith Loop #AD-56914,Adidas,5.5,25
3/3/2022,Sample 6000037315/HQ3961/S2T FW22,Outsole Originals Stan Smith Loop #AD-56914,Adidas,4.5,25
3/3/2022,Sample 6000037315/HQ3961/S2T FW22,Outsole Originals Stan Smith Loop #AD-56914,Adidas,12.5,15
3/3/2022,Sample 6000037315/HQ3961/S2T FW22,Outsole Originals Stan Smith Loop #AD-56914,Adidas,7.5,25
3/3/2022,Sample 6000037315/HQ3961/S2T FW22,Outsole Originals Stan Smith Loop #AD-56914,Adidas,13.5,15
3/3/2022,SAMPLE: 80087389,Outsole Ultra FG Jr #FB1107,Puma,10K-10.5K,10
3/3/2022,SAMPLE: 80087389,Outsole Ultra FG Jr #FB1107,Puma,13K-13.5K,20
3/3/2022,SAMPLE: 80087389,Outsole Ultra FG Jr #FB1107,Puma,11K-11.5K,20
3/3/2022,SAMPLE: 80087389,Outsole Ultra FG Jr #FB1107,Puma,12K-12.5K,10
3/3/2022,SAMPLE: B3ZX22030100(C-YY2DB-220303-810)/AM220228-,Plate Velosamba #AD-45015,Adidas,8.5-9,6
3/3/2022,SAMPLE: B3ZX22030100(C-YY2DB-220303-810)/AA220303-,Torsion Bar Adizero Pro V2 #AD-52582,Adidas,8.5-9,2
3/3/2022,SAMPLE: B3ZX22030100(C-YY2DB-220303-810)/DA220226-,Torsion Bar Adizero Pro V2 #AD-52582,Adidas,8.5-9,1
3/2/2022,SAMPLE: FMVN-22030105,Outsole Evo Speed 5 NG FG J´s#FB1017,Puma,3-3.5,30
3/2/2022,SAMPLE: FMVN-22030105,Outsole evoSPEED 360.5 FG#FB1010,Puma,8-8.5,41
3/2/2022,SAMPLE: FMVN-22030105,Outsole Future MG #FB1095,Puma,8-8.5,3
3/2/2022,A-FRA211227-P1,PANEL ULTRA 4D #AD30832,Adidas,8-9,15
3/2/2022,Sample TAX-LY20220300274/HQ7045/ MCS FW22,Shank insert Yeezy Boost 350V2 #AD-927,Adidas,8.5,10
3/2/2022,Sample TAX-LY20220300328/HQ7045/ CS1 FW22,Shank insert Yeezy Boost 350V2 #AD-927,Adidas,8.5,5
3/2/2022,SAMPLE: B3ZX22030046(C-YY2DB-220302-806)/AA220302-,Torsion Bar Adizero Pro V2 #AD-52582,Adidas,8.5-9,1
3/2/2022,SAMPLE: B3ZX22020360(C-YY2DB-220223-826)/CA220222-,Torsion Bar Solar Boost #AD-47694,Adidas,5-6,9
3/2/2022,SAMPLE: FRAVNU220005,TPU Upper single density Ultra boost ST #AD-39031SD,,5-6,15
3/1/2022,YIIW004606FC/C-YY2SF     -220225-007,Insole Board X20 FG #11046,Adidas,8.5,36
3/1/2022,Sample ENR2202280010/ENR2202280030,Outsole #PHG001,NB,9.5-10,2
3/1/2022,Sample ENR2202280029,Outsole Furon 6 FG #PFG002,NB,9.5-10,16
3/1/2022,Sample ENR2202080017,Outsole Furon 6 FG #PFG002,NB,10.5-11,1
3/1/2022,Sample ENR2202280018,Outsole Tekela 4 FG #PFG004,NB,9.5-10,15
3/1/2022,Sample ENR2202280008,Outsole Tekela HG #NSM-THG01,,9.5-10,1
3/1/2022,Sample ENR2202280008,Outsole Tekela HG #NSM-THG01,,9.5-10,1
3/1/2022,DEV REQUEST,TPU Lateral & Medial #BBKLV3,NB,9.5-11,50
3/1/2022,DEV REQUEST,TPU Lateral & Medial #BBKLV3,NB,9.5-11,10
3/1/2022,DEV REQUEST,TPU Lateral & Medial #BBKLV3,NB,9.5-11,50
3/1/2022,DEV REQUEST,TPU Lateral & Medial #BBKLV3,NB,9.5-11,10
3/1/2022,DEV REQUEST,TPU Lateral & Medial #BBKLV3,NB,9.5-11,10
3/1/2022,DEV REQUEST,TPU Lateral & Medial #BBKLV3,NB,9.5-11,10
3/1/2022,DEV REQUEST,TPU Lateral & Medial #BBKLV3,NB,9.5-11,10
3/1/2022,DEV REQUEST,TPU Lateral & Medial #BBKLV3,NB,9.5-11,10
2/28/2022,Sample DEV THY_20220228_LEGO WINTERPLAY/Trial colo,Heelcap Lego Vintro Boot C #59052-HC,Adidas,11K-12K,10
2/28/2022,Sample FRVN220228-1=>8/MCS/TEST FW22,Heelcap Zenchill XXII #59701-HT,Adidas,5-6,35
2/28/2022,Sample FRVN220228-1=>8/MCS/TEST FW22,Heelcap Zenchill XXII #59701-HT,Adidas,8-9,35
2/28/2022,Sample FRVN220228-1=>8/MCS/TEST FW22,Heelcap Zenchill XXII #59701-HT,Adidas,5-6,35
2/28/2022,Sample FRVN220228-1=>8/MCS/TEST FW22,Heelcap Zenchill XXII #59701-HT,Adidas,8-9,35
2/28/2022,Sample FRVN220228-1=>8/MCS/TEST FW22,Heelcap Zenchill XXII #59701-HT,Adidas,5-6,35
2/28/2022,Sample FRVN220228-1=>8/MCS/TEST FW22,Heelcap Zenchill XXII #59701-HT,Adidas,8-9,35
2/28/2022,Sample FRVN220226-1=>19/CS2  FW22,Heelcap Zenchill XXII #59701-HT,Adidas,5-6,10
2/28/2022,Sample FRVN220226-1=>19/CS2  FW22,Heelcap Zenchill XXII #59701-HT,Adidas,9.5-10.5,10
2/28/2022,Sample FRVN220226-1=>19/CS2  FW22,Heelcap Zenchill XXII #59701-HT,Adidas,8-9,10
2/28/2022,Sample FRVN220226-1=>19/CS2  FW22,Heelcap Zenchill XXII #59701-HT,Adidas,3.5-4.5,10
2/28/2022,Sample FRVN220226-1=>19/CS2  FW22,Heelcap Zenchill XXII #59701-HT,Adidas,6.5-7.5,20
2/28/2022,Sample FRVN220226-1=>19/CS3  FW22,Heelcap Zenchill XXII #59701-HT,Adidas,9.5-10.5,10
2/28/2022,Sample FRVN220226-1=>19/CS3  FW22,Heelcap Zenchill XXII #59701-HT,Adidas,3.5-4.5,5
2/28/2022,Sample FRVN220226-1=>19/CS3  FW22,Heelcap Zenchill XXII #59701-HT,Adidas,8-9,15
2/28/2022,Sample FRVN220226-1=>19/CS3  FW22,Heelcap Zenchill XXII #59701-HT,Adidas,5-6,15
2/28/2022,Sample FRVN220226-1=>19/CS3  FW22,Heelcap Zenchill XXII #59701-HT,Adidas,6.5-7.5,5
2/28/2022,Sample FRVN220226-1=>19/CS3  FW22,Heelcap Zenchill XXII #59701-HT,Adidas,12.5-13.5,5
2/28/2022,Sample FRVN220226-1=>19/CS3  FW22,Heelcap Zenchill XXII #59701-HT,Adidas,11-12,10
2/28/2022,SAMPLE: B3ZX22020485(C-YY2DB-220228-804)/DA220226-,Midsole Blades Adizero SUB 2 #AD-53755,Adidas,8-9,2
2/28/2022,DEV REQUEST,Shank BB2WXYV3,NB,9.5-12,20
2/28/2022,SAMPLE: B3ZX22020485(C-YY2DB-220228-804)/DA220226-,Torsion Bar Adizero Pro V2 #AD-52582,Adidas,8.5-9,2
2/28/2022,DEV REQUEST,TPU BB2WXYV3,NB,9.5-10.5,20
2/25/2022,SAMPLE: FMVN-22022105,Heel Counter TS030,Puma,No.4(7.5-8.5),923
2/25/2022,SAMPLE: FMVN-22022105,Heel Counter TS030,Puma,No.1(3-4),115
2/25/2022,SAMPLE: FMVN-22022105,Heel Counter TS030,Puma,No.3(6-7),163
2/25/2022,SAMPLE: FMVN-22022105,Heel counter TS033,Puma,No.4(7.5-8.5),287
2/25/2022,SAMPLE: FMVN-22022105,Heel counter TS042,Puma,No.3(6-7),6
2/25/2022,SAMPLE: A-FRA220224,Heelcap Ultra 4D #AD30832,Adidas,8-9,20
2/25/2022,Sample ZTH22022318557/IND SS22,Outsole #ATC497,Puma,8.5,1
2/25/2022,Sample ZTH22022318663/IND SS22,Outsole #ATC497,Puma,8.5,3
2/25/2022,SAMPLE: A-FRA220224,PANEL ULTRA 4D #AD30832,Adidas,8-9,20
2/25/2022,DEV-TAI-2022.02.21,PANEL ULTRA 4D #AD30832,Adidas,8-9,30
2/25/2022,SAMPLE: FM220005,Shank Deviate 2 #JO1162,Puma,6-7,36
2/25/2022,SAMPLE: FM220005,Shank Deviate 2 #JO1162,Puma,7.5-8.5,164
2/25/2022,SAMPLE: FM220005,Shank Deviate 2 #JO1162,Puma,4.5-5.5,136
2/25/2022,SAMPLE: FM220005,Shank Deviate 2 #JO1162,Puma,9-10,38
2/25/2022,SAMPLE: FRAVNB220003+04+05,Torsion Bar Adizero Pro V2 #AD-52582,Adidas,12.5-13,1
2/25/2022,SAMPLE: FRAVNB220003+04+05,Torsion Bar Adizero Pro V2 #AD-52582,Adidas,13.5-14.5,1
2/25/2022,FK220127-005L,Torsion Bar Adizero Pro V2 #AD-52582,Adidas,10.5-11,1
2/25/2022,FK220127-005L,Torsion Bar Adizero Pro V2 #AD-52582,Adidas,5.5-6,1
2/25/2022,FK220127-005L,Torsion Bar Adizero Pro V2 #AD-52582,Adidas,11.5-12,1
2/25/2022,FK220127-005L,Torsion Bar Adizero Pro V2 #AD-52582,Adidas,12.5-13,2
2/25/2022,FK220127-005L,Torsion Bar Adizero Pro V2 #AD-52582,Adidas,6.5-7,1
2/25/2022,SAMPLE: B3ZX22020443(C-YY2DB -220225-810)/DA220224,Torsion Bar Adizero Pro V2 #AD-52582,Adidas,8.5-9,3
2/25/2022,SAMPLE: B3ZX22020443(C-YY2DB -220225-810)/DA220224,Torsion Bar Adizero Pro V2 #AD-52582,Adidas,8.5-9,2
2/25/2022,SAMPLE: FRAVNB220011,TPU Shank Base Line 1.0 #50062001,Reebok,M:11-12,3
2/25/2022,SAMPLE: FRAVNB220011,TPU Shank Base Line 1.0 #50062001,Reebok,M:6.5-7.5(W:8-9),3
2/25/2022,SAMPLE: FRAVNB220011,TPU Shank Base Line 1.0 #50062001,Reebok,M:8-9(W:9.5-10.5),4
2/24/2022,SAMPLE: VDM_2022/02/22,Heel Counter TS030,Puma,No.4(7.5-8.5),171
2/24/2022,SAMPLE: VDM_2022/02/22,Heel Counter TS030,Puma,No.3(6-7),30
2/24/2022,SAMPLE: VDM_2022/02/22,Heel counter TS033,Puma,No.4(7.5-8.5),1053
2/24/2022,SAMPLE: VDM_2022/02/22,Heel counter TS033,Puma,No.1(3-4),116
2/24/2022,SAMPLE: VDM_2022/02/22,Heel counter TS033,Puma,No.2(4.5-5.5),93
2/24/2022,SAMPLE: VDM_2022/02/22,Heel counter TS033,Puma,No.6(10.5-11.5),85
2/24/2022,SAMPLE: VDM_2022/02/22,Heel counter TS033,Puma,No.7(12-13),25
2/24/2022,SAMPLE: VDM_2022/02/22,Heel counter TS033,Puma,No.5(9-10),185
2/24/2022,SAMPLE: VDM_2022/02/22,Heel counter TS033,Puma,No.3(6-7),243
2/24/2022,SAMPLE: VDM_2022/02/22,Heel counter TS042,Puma,No.4(7.5-8.5),290
2/24/2022,SAMPLE: VDM_2022/02/22,Heel counter TS042,Puma,No.3(6-7),22
2/24/2022,SAMPLE: B3ZX22020359(C-YY2DB-220223-825)/DS220222-,Insole Board #30707,Adidas,8.5,13
2/24/2022,DEV REQUEST,NB CR M/W574,NB,M:4-8.5/W:5.5-10,30
2/24/2022,DEV REQUEST,NB CR M/W574,NB,M:4-8.5/W:5.5-10,10
2/24/2022,DEV REQUEST,NB CR M/W574,NB,M:4-8.5/W:5.5-10,10
2/24/2022,DEV REQUEST,NB CR M/W574,NB,M:4-8.5/W:5.5-10,10
2/24/2022,SAMPLE: B3ZX22020394(C-YY2DB-220224-808)/CA220222-,Outsole Adizero TJ #AD-30571,Adidas,7.5-8.5,9
2/24/2022,,Outsole Evospeed 3+4 i SG#FB396,Puma,9-9.5,5
2/24/2022,SAMPLE: VDM_2022/02/21,Outsole Future FG-AG #FB1118,Puma,8,3
2/24/2022,SAMPLE: VDM_2022/02/21,Outsole Future FG-AG #FB1118,Puma,8,5
2/24/2022,SAMPLE: VDM_2022/02/21,Outsole Future FG-AG #FB1118,Puma,8,12
2/24/2022,SAMPLE: VDM_2022/02/21,Outsole Future FG-AG #FB1118,Puma,6,5
2/24/2022,SAMPLE: VDM_2022/02/21,Outsole Future FG-AG #FB1118,Puma,6,3
2/24/2022,SAMPLE: VDM_2022/02/21,Outsole Future FG-AG #FB1118,Puma,8,5
2/24/2022,SAMPLE: VDM_2022/02/14,Outsole FW20 Puma Future 2.0 #FB1064,Puma,9,7
2/24/2022,SAMPLE: VDM_2022/02/14,Outsole Game Changer Pro #FB1043,Puma,7,7
2/24/2022,SAMPLE: VDM_2022/02/14,Outsole Game Changer Pro #FB1043,Puma,8,3
2/24/2022,SAMPLE: B3ZX22020394(C-YY2DB-220224-808)/CA220223-,Outsole Plate Sprint Star #AD-39902,Adidas,8-8.5,9
2/24/2022,SAMPLE: B3ZX22020394(C-YY2DB-220224-808)/CA220223-,Outsole Plate Sprint Star #AD-39902,Adidas,8-8.5,9
2/24/2022,SAMPLE: B3ZX22020355(C-YY2DB-220223-821)/CA220223-,Outsole Plate Sprint Star #AD-39902,Adidas,8-8.5,9
2/24/2022,SAMPLE: B3ZX22020301(C-YY2DB220221-831)/DA220219-0,Torsion Bar Adizero Pro V2 #AD-52582,Adidas,8.5-9,7
2/24/2022,SAMPLE: B3ZX22020394(C-YY2DB-220224-808)/DA220223-,Torsion Bar Adizero Pro V2 #AD-52582,Adidas,8.5-9,4
2/24/2022,SAMPLE: B3ZX22020398(C-YY2DB-220224-812)/CA220223-,Torsion Bar Adizero Pro V2 #AD-52582,Adidas,8.5-9,15
2/24/2022,SAMPLE: B3ZX22020355(C-YY2DB-220223-821)/DA220223-,Torsion Bar Adizero Pro V2 #AD-52582,Adidas,4.5-5,4
2/24/2022,SAMPLE: B3ZX22020355(C-YY2DB-220223-821)/DA220223-,Torsion Bar Adizero Pro V2 #AD-52582,Adidas,10.5-11,1
2/24/2022,SAMPLE: B3ZX22020355(C-YY2DB-220223-821)/DA220223-,Torsion Bar Adizero Pro V2 #AD-52582,Adidas,7.5-8,10
2/24/2022,SAMPLE: B3ZX22020355(C-YY2DB-220223-821)/DA220223-,Torsion Bar Adizero Pro V2 #AD-52582,Adidas,5.5-6,6
2/24/2022,SAMPLE: B3ZX22020355(C-YY2DB-220223-821)/DA220223-,Torsion Bar Adizero Pro V2 #AD-52582,Adidas,9.5-10,5
2/24/2022,SAMPLE: B3ZX22020355(C-YY2DB-220223-821)/DA220223-,Torsion Bar Adizero Pro V2 #AD-52582,Adidas,6.5-7,5
2/24/2022,SAMPLE: B3ZX22020355(C-YY2DB-220223-821)/CA220223-,Torsion Bar Solar Boost #AD-47694,Adidas,8-9,9
2/23/2022,SAMPLE: A-FRA220212-P1,Heelcap Ultra 4D #AD30832,Adidas,8-9,12
2/23/2022,Sample ENR2202170020 ( Giao kho PT),Insole Board JV8-0425-1,NB,13,1
2/23/2022,Sample ENR2202170020 ( Giao kho PT),Insole Board JV8-0425-1,NB,9.5,1
2/23/2022,Sample ENR2202220030( Giao kho PT),Outsole Furon 3 FG TD #NSM-FFG02TD,NB,13.5-14,3
2/23/2022,Sample ENR2202220030( Giao kho PT),Outsole Furon 3 FG TD #NSM-FFG02TD,NB,7.5-8,3
2/23/2022,Sample ENR2202220030( Giao kho PT),Outsole Furon 3 FG TD #NSM-FFG02TD,NB,8.5-9,3
2/23/2022,Sample ENR2202220030( Giao kho PT),Outsole Furon 3 FG TD #NSM-FFG02TD,NB,10.5-11,3
2/23/2022,Sample ENR2202220030( Giao kho PT),Outsole Furon 3 FG TD #NSM-FFG02TD,NB,11.5-12,3
2/23/2022,Sample ENR2202220030( Giao kho PT),Outsole Furon 3 FG TD #NSM-FFG02TD,NB,9.5-10,3
2/23/2022,Sample ENR2202220030( Giao kho PT),Outsole Furon 3 FG TD #NSM-FFG02TD,NB,12.5-13,3
2/23/2022,Sample ENR2202170020 ( Giao kho PT),Outsole Furon 4/ Tekela 1 HG Js #NSJ-THG1,NB,3-3.5,2
2/23/2022,Sample ENR2202220026,Outsole Furon 6 FG #PFG002,NB,9.5-10,6
2/23/2022,SAMPLE: FMVN-22022203,Outsole Game Changer Pro #FB1043,Puma,6.5,4
2/23/2022,SAMPLE: FMVN-22022203,Outsole Game Changer SG#FB1044,Puma,6.5,5
2/23/2022,SAMPLE: FMVN-22022203,Outsole Game Changer SG#FB1044,Puma,8.5,2
2/23/2022,SAMPLE: FMVN-22022203,Outsole Pace Mx SG.1.2 #FB1066,Puma,8,6
2/23/2022,SAMPLE: FMVN-22022203,Outsole Puma PACE #FB1065,Puma,8,6
2/23/2022,SAMPLE: A-FRA220212-P1,PANEL ULTRA 4D #AD30832,Adidas,8-9,12
2/23/2022,SAMPLE: A-FRA220223,PANEL ULTRA 4D #AD30832,Adidas,8-9,10
2/23/2022,SAMPLE: A-FRA220223,PANEL ULTRA 4D #AD30832,Adidas,9.5-10.5,10
2/23/2022,SAMPLE: A-FRA220223,PANEL ULTRA 4D #AD30832,Adidas,6.5-7.5,10
2/23/2022,SAMPLE: A-FRA220223,PANEL ULTRA 4D #AD30832,Adidas,12.5-13.5,10
2/23/2022,SAMPLE: A-FRA220223,PANEL ULTRA 4D #AD30832,Adidas,11-12,10
2/23/2022,SAMPLE: A-FRA220223,PANEL ULTRA 4D #AD30832,Adidas,5-6,10
2/22/2022,DEV REQUEST,Outsole #PHG001,NB,9.5-10,20
2/22/2022,DEV REQUEST,Outsole Furon 3 FG #NSM-FFG02,NB,9.5-10,10
2/22/2022,SAMPLE: VDM_2022/02/19,Outsole Future FG-AG #FB1118,Puma,6,58
2/22/2022,SAMPLE: VDM_2022/02/19,Outsole Future FG-AG #FB1118,Puma,6,44
2/22/2022,SAMPLE: VDM_2022/02/19,Outsole Future FG-AG #FB1118,Puma,8,24
2/22/2022,SAMPLE: VDM_2022/02/19,Outsole Future FG-AG #FB1118,Puma,6,25
2/22/2022,SAMPLE: VDM_2022/02/19,Outsole Future FG-AG #FB1118,Puma,8,27
2/22/2022,SAMPLE: VDM_2022/02/19,Outsole Future MG #FB1095,Puma,8-8.5,10
2/22/2022,SAMPLE: VDM_2022/02/19,Outsole Future MG #FB1095,Puma,8-8.5,10
2/22/2022,SAMPLE: VDM_2022/02/19,Outsole Future MxSG #FB1119,Puma,8,23
2/22/2022,SAMPLE: B3ZX22020238(C-YY2DB-220218-811),Outsole Quickframe 2.0 #43685,,13,1
2/22/2022,SAMPLE: B3ZX22020238(C-YY2DB-220218-811),Outsole Quickframe 2.0 #43685,,12,1
2/21/2022,Sample GFRVN220221P136008-NB,Shank Propelv4 #PROPELV4,NB,M:9.5-10.5/W:11-12,76
2/21/2022,Sample ENR2202190020,TPU BB2WXYV3,NB,14-15,2
2/21/2022,Sample ENR2202190020,TPU BB2WXYV3,NB,5-6,2
2/21/2022,Sample ENR2202190020,TPU BB2WXYV3,NB,8-9,2
2/21/2022,Sample ENR2202190020,TPU BB2WXYV3,NB,6.5-7.5,4
2/21/2022,Sample ENR2202190020,TPU BB2WXYV3,NB,16-18,6
2/21/2022,Sample ENR2202190020,TPU BB2WXYV3,NB,12.5-13.5,4
2/19/2022,Sample EGR2202180008,Shank Hyperion Rocket,Brooks,9-9.5,35
2/18/2022,DEV REQUESRT,Outsole ELMN8 V7 #40533,Brooks,12,1
2/18/2022,DEV REQUESRT,Outsole ELMN8 V7 #40533,Brooks,8-8.5,1
2/18/2022,DEV REQUESRT,Outsole ELMN8 V7 #40533,Brooks,13,1
2/18/2022,DEV REQUESRT,Outsole ELMN8 V7 #40533,Brooks,9-9.5,1
2/18/2022,DEV REQUESRT,Outsole ELMN8 V7 #40533,Brooks,11-11.5,1
2/18/2022,DEV REQUESRT,Outsole ELMN8 V7 #40533,Brooks,6-6.5,1
2/18/2022,DEV REQUESRT,Outsole ELMN8 V7 #40533,Brooks,7-7.5,1
2/18/2022,DEV REQUESRT,Outsole ELMN8 V7 #40533,Brooks,10-10.5,1
2/18/2022,DEV REQUESRT,Outsole ELMN8 V7 #40533,Brooks,4-4.5,1
2/18/2022,DEV REQUESRT,Outsole ELMN8 V7 #40533,Brooks,5-5.5,1
2/18/2022,DEV REQUESRT,Outsole ELMN8 V7 #40533,Brooks,3-3.5,1
2/18/2022,SAMPLE: VDM_2022/02/11,Outsole FW20 Puma Future 2.0 #FB1064,Puma,8,23
2/18/2022,SAMPLE: VDM_2022/02/11,Outsole FW20 Puma Future 2.0 #FB1064,Puma,8,17
2/18/2022,SAMPLE: VDM_2022/02/11,Outsole FW20 Puma Future 2.0 #FB1064,Puma,9.5,6
2/18/2022,SAMPLE: VDM_2022/02/11,Outsole FW20 Puma Future 2.0 #FB1064,Puma,10,2
2/18/2022,SAMPLE: VDM_2022/02/11,Outsole FW20 Puma Future 2.0 #FB1064,Puma,10,6
2/18/2022,SAMPLE: VDM_2022/02/11,Outsole FW20 Puma Future 2.0 #FB1064,Puma,9.5,2
2/18/2022,SAMPLE: VDM_2022/02/11,Outsole FW20 Puma Future 2.0 #FB1064,Puma,11,6
2/18/2022,SAMPLE: VDM_2022/02/11,Outsole FW20 Puma Future 2.0 #FB1064,Puma,10.5,6
2/18/2022,SAMPLE: VDM_2022/02/11,Outsole FW20 Puma Future 2.0 #FB1064,Puma,7.5,6
2/18/2022,SAMPLE: VDM_2022/02/11,Outsole FW20 Puma Future 2.0 #FB1064,Puma,8.5,3
2/18/2022,SAMPLE: VDM_2022/02/11,Outsole FW20 Puma Future 2.0 #FB1064,Puma,9,3
2/18/2022,SAMPLE: VDM_2022/02/11,Outsole FW20 Puma Future 2.0 #FB1064,Puma,7,6
2/18/2022,SAMPLE: VDM_2022/02/11,Outsole FW20 Puma Future 2.0 #FB1064,Puma,8.5,6
2/18/2022,SAMPLE: VDM_2022/02/11,Outsole FW20 Puma Future 2.0 #FB1064,Puma,9,6
2/18/2022,BU HANG : PUMA_2021/11/19,Outsole FW20 Puma Future 2.0 #FB1064,Puma,8,4
2/18/2022,BU HANG : PUMA_2021/11/19,Outsole FW20 Puma Future 2.0 #FB1064,Puma,10,2
2/18/2022,BU HANG : PUMA_2021/11/19,Outsole FW20 Puma Future 2.0 #FB1064,Puma,6,3
2/18/2022,BU HANG : PUMA_2021/11/19,Outsole FW20 Puma Future 2.0 #FB1064,Puma,8,2
2/18/2022,DEV REQUEST,Outsole Tekela 4 FG #PFG004,NB,9.5-10,10
2/18/2022,SAMPLE: 80086953+80086773+80086975,Outsole Ultra FG #FB1106 P3,Puma,8-8.5,50
2/18/2022,SAMPLE: 80086953+80086773+80086975,Outsole Ultra FG #FB1106 P3,Puma,8-8.5,60
2/18/2022,SAMPLE: 80086953+80086773+80086975,Outsole Ultra FG #FB1106 P3,Puma,8-8.5,30
2/18/2022,SAMPLE: 80086953+80086773+80086975,Outsole Ultra FG #FB1106 P3,Puma,8-8.5,30
2/18/2022,SAMPLE: 80086953+80086773+80086975,Outsole Ultra FG #FB1106 P3,Puma,8-8.5,60
2/18/2022,SAMPLE: 80086953+80086773+80086975,Outsole Ultra FG #FB1106 P3,Puma,9-9.5,20
2/18/2022,SAMPLE: 80086953+80086773+80086975,Outsole Ultra FG #FB1106 P3,Puma,8-8.5,20
2/18/2022,SAMPLE: 80086953+80086773+80086975,Outsole Ultra FG #FB1106 P3,Puma,7-7.5,20
2/18/2022,SAMPLE: 80086953+80086773+80086975,Outsole Ultra FG #FB1106 P3,Puma,9-9.5,20
2/18/2022,SAMPLE: 80086953+80086773+80086975,Outsole Ultra FG #FB1106 P3,Puma,6-6.5,20
2/18/2022,SAMPLE: 80086953+80086773+80086975,Outsole Ultra FG #FB1106 P3,Puma,11-11.5,10
2/18/2022,SAMPLE: 80086953+80086773+80086975,Outsole Ultra FG #FB1106 P3,Puma,6-6.5,20
2/18/2022,SAMPLE: 80086953+80086773+80086975,Outsole Ultra FG #FB1106 P3,Puma,7-7.5,20
2/18/2022,SAMPLE: 80086953+80086773+80086975,Outsole Ultra FG #FB1106 P3,Puma,10-10.5,20
2/18/2022,SAMPLE: 80086953+80086773+80086975,Outsole Ultra FG #FB1106 P3,Puma,11-11.5,10
2/18/2022,SAMPLE: 80086953+80086773+80086975,Outsole Ultra FG #FB1106 P3,Puma,10-10.5,20
2/18/2022,SAMPLE: 80086953+80086773+80086975,Outsole Ultra FG Jr #FB1107,Puma,3-3.5,30
2/18/2022,SAMPLE: 80086953+80086773+80086975,Outsole Ultra FG Jr #FB1107,Puma,3-3.5,20
2/18/2022,SAMPLE: 80086953+80086773+80086975,Outsole Ultra FG Jr #FB1107,Puma,4-4.5,20
2/18/2022,SAMPLE: 80086953+80086773+80086975,Outsole Ultra FG Jr #FB1107,Puma,5-5.5,10
2/18/2022,SAMPLE: 80086953+80086773+80086975,Outsole Ultra FG Jr #FB1107,Puma,3-3.5,60
2/18/2022,SAMPLE: 80086953+80086773+80086975,Outsole Ultra FG Jr #FB1107,Puma,1-1.5,20
2/18/2022,SAMPLE: 80086953+80086773+80086975,Outsole Ultra FG Jr #FB1107,Puma,2-2.5,20
2/18/2022,DEV REQUESRT,Outsole Wire 8 #40534,Brooks,8-8.5,1
2/18/2022,DEV REQUESRT,Outsole Wire 8 #40534,Brooks,9-9.5,1
2/18/2022,DEV REQUESRT,Outsole Wire 8 #40534,Brooks,7-7.5,1
2/18/2022,DEV REQUESRT,Outsole Wire 8 #40534,Brooks,5-5.5,1
2/18/2022,DEV REQUESRT,Outsole Wire 8 #40534,Brooks,13,1
2/18/2022,DEV REQUESRT,Outsole Wire 8 #40534,Brooks,4-4.5,1
2/18/2022,DEV REQUESRT,Outsole Wire 8 #40534,Brooks,6-6.5,1
2/18/2022,DEV REQUESRT,Outsole Wire 8 #40534,Brooks,11-11.5,1
2/18/2022,DEV REQUESRT,Outsole Wire 8 #40534,Brooks,12,1
2/18/2022,DEV REQUESRT,Outsole Wire 8 #40534,Brooks,10-10.5,1
2/17/2022,DEV REQUEST,Insole Board Speed Board Cloud X2 #ON054-SB,ON Running,10,20
2/17/2022,DEV REQUEST,Insole Board Speed Board Cloud X2 #ON054-SB,ON Running,10,20
2/17/2022,SAMPLE: B3ZX22020192(C-YY2DB-220217-803),Insole Board X20 FG #11046,Adidas,9.5,40
2/17/2022,SAMPLE: B3ZX22020192(C-YY2DB-220217-803),Insole Board X20 FG #11046,Adidas,11,16
2/17/2022,SAMPLE: B3ZX22020192(C-YY2DB-220217-803),Insole Board X20 FG #11046,Adidas,4,1
2/17/2022,SAMPLE: B3ZX22020192(C-YY2DB-220217-803),Insole Board X20 FG #11046,Adidas,10,16
2/17/2022,SAMPLE: B3ZX22020192(C-YY2DB-220217-803),Insole Board X20 FG #11046,Adidas,10.5,40
2/17/2022,SAMPLE: B3ZX22020192(C-YY2DB-220217-803),Insole Board X20 FG #11046,Adidas,6,1
2/17/2022,SAMPLE: B3ZX22020192(C-YY2DB-220217-803),Insole Board X20 FG #11046,Adidas,11,1
2/17/2022,SAMPLE: B3ZX22020192(C-YY2DB-220217-803),Insole Board X20 FG #11046,Adidas,12,8
2/17/2022,SAMPLE: B3ZX22020192(C-YY2DB-220217-803),Insole Board X20 FG #11046,Adidas,8,80
2/17/2022,SAMPLE: B3ZX22020192(C-YY2DB-220217-803),Insole Board X20 FG #11046,Adidas,11.5,8
2/17/2022,SAMPLE: B3ZX22020192(C-YY2DB-220217-803),Insole Board X20 FG #11046,Adidas,13,1
2/17/2022,SAMPLE: B3ZX22020192(C-YY2DB-220217-803),Insole Board X20 FG #11046,Adidas,9,16
2/17/2022,SAMPLE: B3ZX22020192(C-YY2DB-220217-803),Insole Board X20 FG #11046,Adidas,7,1
2/17/2022,SAMPLE: B3ZX22020192(C-YY2DB-220217-803),Insole Board X20 FG #11046,Adidas,12,1
2/17/2022,SAMPLE: B3ZX22020192(C-YY2DB-220217-803),Insole Board X20 FG #11046,Adidas,8.5,16
2/17/2022,SAMPLE: B3ZX22020192(C-YY2DB-220217-803),Insole Board X20 FG #11046,Adidas,9,1
2/17/2022,SAMPLE: YIIW003607FC(C-Y2SWM-220126-004),Midsole Climawarm T&P #57531,Adidas,8.5,3
2/17/2022,SAMPLE: YIIW003607FC(C-Y2SWM-220126-004),Midsole Climawarm T&P #57531,Adidas,5.5,3
2/17/2022,Sample ENR2202170019 ( Giao kho PT),Outsole #PHG001,NB,5.5-6,2
2/17/2022,Sample ENR2202170019 ( Giao kho PT),Outsole #PHG001,NB,7.5-8,2
2/17/2022,Sample ENR2202170019 ( Giao kho PT),Outsole #PHG001,NB,10.5-11,1
2/17/2022,Sample ENR2202170019 ( Giao kho PT),Outsole #PHG001,NB,8.5-9,2
2/17/2022,Sample ENR2202170019 ( Giao kho PT),Outsole #PHG001,NB,9.5-10,2
2/17/2022,Sample ENR2202170019 ( Giao kho PT),Outsole #PHG001,NB,6.5-7,2
2/17/2022,Sample DEV QUYNH_20220216_42663 P0P1 SG WT sample,Outsole Agility SG#42663,Adidas,8.5,25
2/17/2022,Sample VDM20220216-31-120==> 126,Outsole NB Composite COMPV1,NB,9.5-10,14
2/17/2022,Sample VDM20220216-31-117==> 119,Outsole NB#MB4040V4,NB,M'S11-11.5/W's12.5-13,7
2/17/2022,Sample VDM20220216-31-117==> 119,Outsole NB#MB4040V4,NB,M'S11-11.5/W's12.5-13,21
2/17/2022,Sample DEV THY_20220216_EQ19_YF printing,Panel EQ19 RUN #55178,Adidas,5-5.5,20
2/17/2022,Sample DEV THY_20220216_EQ19_YF printing,Panel EQ19 RUN #55178,Adidas,5-5.5,30
2/17/2022,Sample DEV THY_20220216_EQ19_YF printing,Panel EQ19 RUN #55178,Adidas,8-8.5,30
2/17/2022,Sample ENR2202160005,TPU BB2WXYV3,NB,12.5-13.5,13
2/16/2022,DEV-TAI-2022-02-16,Midsole Climawarm T&P #57531,Adidas,8.5,10
2/16/2022,Sample ENR2202150015/ENR2202160002/0007,Outsole #PHG001,NB,9.5-10,9
2/16/2022,SAMPLE: FMVN-22021504,Outsole Evo Speed 5 NG FG J´s#FB1017,Puma,3-3.5,40
2/16/2022,SAMPLE: VDM_2022/02/14,Outsole Evospeed 3+4 i SG#FB396,Puma,9-9.5,-1
2/16/2022,SAMPLE: FMVN-22021504,Outsole evoSPEED 360.5 FG#FB1010,Puma,8-8.5,45
2/16/2022,Sample ENR2202160002/ENR2202160007,Outsole Furon 6 FG #PFG002,NB,9.5-10,24
2/16/2022,DEV-TAM-2022-02-16,Outsole Future FG-AG #FB1118,Puma,8,20
2/16/2022,DEV-TAM-2022-02-16,Outsole Future FG-AG #FB1118,Puma,8,20
2/16/2022,DEV-TAM-2022-02-16,Outsole Future FG-AG #FB1118,Puma,8,20
2/16/2022,DEV-TAM-2022-02-16,Outsole Future FG-AG #FB1118,Puma,8,2
2/16/2022,DEV-TAM-2022-02-16,Outsole Future FG-AG #FB1118,Puma,8,40
2/16/2022,DEV-TAM-2022-02-16,Outsole Future FG-AG #FB1118,Puma,8,20
2/16/2022,DEV-TAM-2022-02-16,Outsole Future FG-AG #FB1118,Puma,8,20
2/16/2022,DEV-TAM-2022-02-16,Outsole Future FG-AG #FB1118,Puma,8,20
2/16/2022,DEV-TAM-2022-02-16,Outsole Future FG-AG #FB1118,Puma,6,2
2/16/2022,DEV-TAM-2022-02-16,Outsole Future FG-AG #FB1118,Puma,8,2
2/16/2022,DEV-TAM-2022-02-16,Outsole Future FG-AG #FB1118,Puma,8,40
2/16/2022,DEV-TAM-2022-02-16,Outsole Future MG #FB1095,Puma,8-8.5,2
2/16/2022,DEV-TAM-2022-02-16,Outsole Future MG #FB1095,Puma,8-8.5,20
2/16/2022,DEV-TAM-2022-02-16,Outsole Future MG #FB1095,Puma,8-8.5,2
2/16/2022,DEV-TAM-2022-02-16,Outsole Future MG #FB1095,Puma,8-8.5,6
2/16/2022,DEV-TAM-2022-02-16,Outsole Future MG #FB1095,Puma,8-8.5,20
2/16/2022,DEV-TAM-2022-02-16,Outsole Future MG #FB1095,Puma,8-8.5,6
2/16/2022,DEV-TAM-2022-02-16,Outsole Future MG #FB1095,Puma,8-8.5,6
2/16/2022,DEV-TAM-2022-02-16,Outsole Future MG Jr #FB1096,Puma,3-3.5,4
2/16/2022,DEV-TAM-2022-02-16,Outsole Future MG Jr #FB1096,Puma,3-3.5,4
2/16/2022,DEV-TAM-2022-02-16,Outsole Future MG Jr #FB1096,Puma,3-3.5,2
2/16/2022,SAMPLE: VDM_2022/02/14,Outsole Future MxSG #FB1089,Puma,5,3
2/16/2022,BU HANG : VDM_2021/12/23,Outsole Future MxSG #FB1089,Puma,8,4
2/16/2022,BU HANG : VDM_2021/12/23,Outsole Future MxSG #FB1089,Puma,7,15
2/16/2022,BU HANG : VDM_2021/12/23,Outsole Future MxSG #FB1089,Puma,4,4
2/16/2022,BU HANG : VDM_2021/12/23,Outsole Future MxSG #FB1089,Puma,3,7
2/16/2022,BU HANG : VDM_2021/12/23,Outsole Future MxSG #FB1089,Puma,6.5,13
2/16/2022,BU HANG : VDM_2021/12/23,Outsole Future MxSG #FB1089,Puma,8.5,7
2/16/2022,BU HANG : VDM_2021/12/23,Outsole Future MxSG #FB1089,Puma,3.5,3
2/16/2022,BU HANG : VDM_2021/12/23,Outsole Future MxSG #FB1089,Puma,6,9
2/16/2022,BU HANG : VDM_2021/12/23,Outsole Future MxSG #FB1089,Puma,5.5,6
2/16/2022,BU HANG : VDM_2021/12/23,Outsole Future MxSG #FB1089,Puma,9,2
2/16/2022,BU HANG : VDM_2021/12/23,Outsole Future MxSG #FB1089,Puma,7.5,9
2/16/2022,BU HANG : VDM_2021/12/23,Outsole Future MxSG #FB1089,Puma,5,2
2/16/2022,BU HANG : VDM_2021/12/23,Outsole Future MxSG #FB1089,Puma,4.5,3
2/16/2022,DEV-TAM-2022-02-16,Outsole Future MxSG #FB1119,Puma,8,2
2/16/2022,DEV-TAM-2022-02-16,Outsole Future MxSG #FB1119,Puma,8,40
2/16/2022,DEV-TAM-2022-02-16,Outsole Future MxSG #FB1119,Puma,8,2
2/16/2022,DEV-TAM-2022-02-16,Outsole Future MxSG #FB1119,Puma,8,20
2/16/2022,DEV-TAM-2022-02-16,Outsole Future MxSG #FB1119,Puma,8,20
2/16/2022,SAMPLE: VDM_2022/02/14,Outsole FW20 Puma Future 2.0 #FB1064,Puma,7.5,-6
2/16/2022,DEV-TAM-2022-02-16,Outsole FW20 Puma Future 2.0 #FB1064,Puma,8,20
2/16/2022,DEV-TAI-2022-02-16,PANEL ULTRA 4D #AD30832,Adidas,8-9,30
2/16/2022,DEV-TAI-2022-02-16,Shank Climacool Vento #54551,Adidas,6-6.5,25
2/16/2022,DEV REQUESR,Test Plates NB,NB,non size,5
2/16/2022,DEV REQUESR,Test Plates NB,NB,non size,5
2/16/2022,DEV REQUESR,Test Plates NB,NB,non size,5
2/16/2022,DEV REQUESR,Test Plates NB,NB,non size,5
2/16/2022,DEV REQUESR,Test Plates NB,NB,non size,5
2/15/2022,DEVELOPMENT REQUEST,Color Chip_Testing,,non size,20
2/15/2022,DEVELOPMENT REQUEST,Color Chip_Testing,,non size,20
2/15/2022,DEVELOPMENT REQUEST,Color Chip_Testing,,non size,20
2/15/2022,DEVELOPMENT REQUEST,Color Chip_Testing,,non size,20
2/15/2022,DEVELOPMENT REQUEST,Color Chip_Testing,,non size,20
2/15/2022,DEVELOPMENT REQUEST,Color Chip_Testing,,non size,20
2/15/2022,DEVELOPMENT REQUEST,Color Chip_Testing,,non size,20
2/15/2022,DEVELOPMENT REQUEST,Color Chip_Testing,,non size,20
2/15/2022,DEVELOPMENT REQUEST,Color Chip_Testing,,non size,20
2/15/2022,DEVELOPMENT REQUEST,Color Chip_Testing,,non size,20
2/15/2022,DEVELOPMENT REQUEST,Color Chip_Testing,,non size,20
2/15/2022,DEVELOPMENT REQUEST,Color Chip_Testing,,non size,20
2/15/2022,DEVELOPMENT REQUEST,Color Chip_Testing,,non size,20
2/15/2022,DEVELOPMENT REQUEST,Color Chip_Testing,,non size,20
2/15/2022,DEVELOPMENT REQUEST,Color Chip_Testing,,non size,20
2/15/2022,DEVELOPMENT REQUEST,Color Chip_Testing,,non size,20
2/15/2022,DEVELOPMENT REQUEST,Color Chip_Testing,,non size,20
2/15/2022,DEVELOPMENT REQUEST,Color Chip_Testing,,non size,20
2/15/2022,DEVELOPMENT REQUEST,Color Chip_Testing,,non size,20
2/15/2022,DEVELOPMENT REQUEST,Color Chip_Testing,,non size,20
2/15/2022,DEVELOPMENT REQUEST,Color Chip_Testing,,non size,20
2/15/2022,DEVELOPMENT REQUEST,Color Chip_Testing,,non size,20
2/15/2022,Sample DEV THY_20220215_Heel Cap 50% AESU,Heelcap Zenchill XXII #59701-HT,Adidas,8-9,10
2/15/2022,Sample DEV THY_20220215_Heel Cap 50% AESU,Heelcap Zenchill XXII #59701-HT,Adidas,8-9,10
2/15/2022,SAMPLE: VDM_2022/02/14,Outsole Future FG-AG #FB1118,Puma,6,6
2/15/2022,SAMPLE: VDM_2022/02/14,Outsole Future FG-AG #FB1118,Puma,6,6
2/15/2022,SAMPLE: VDM_2022/02/14,Outsole Future MG #FB1095,Puma,8-8.5,10
2/15/2022,"SAMPLE: ""B3ZX22020144(C-YY2DB -220215-816)	""",Outsole Plate Sprint Star #AD-39902,Adidas,8-8.5,1
2/15/2022,SAMPLE: FMVN-21111103,Outsole Puma PACE #FB1065,Puma,8,10
2/15/2022,SAMPLE: FM220001+02+04,Shank Deviate 2 #JO1162,Puma,4.5-5.5,760
2/15/2022,SAMPLE: FM220001+02+04,Shank Deviate 2 #JO1162,Puma,7.5-8.5,750
2/15/2022,Sample FRAMAS220001,Shank Propelv4 #PROPELV4,NB,M:9.5-10.5/W:11-12,12
2/15/2022,Sample FRAMAS220001,Shank Propelv4 #PROPELV4,NB,M:5-6/W:6.5-7.5,10
2/15/2022,SAMPLE: B3ZX22020140(C-YY2DB-220215-812),Torsion Bar Solar Boost #AD-47694,Adidas,8-9,2
2/14/2022,Sample FRVN220212-1=>51/MCS/TEST FW22,Heelcap Zenchill XXII #59701-HT,Adidas,5-6,35
2/14/2022,Sample FRVN220212-1=>51/MCS/TEST FW22,Heelcap Zenchill XXII #59701-HT,Adidas,8-9,35
2/14/2022,DEV REQUEST,Insole Board Speed Board Dual Density #ON048,,7.5,20
2/14/2022,DEV REQUEST,Insole Board Speed Board Dual Density #ON048,,9.5,20
2/14/2022,Sample ENR2202120011,Outsole Furon 3(Take Down) FG J´s #NSJ-FFG02TD,NB,12K-12.5K,4
2/14/2022,Sample ENR2202120011,Outsole Furon 3(Take Down) FG J´s #NSJ-FFG02TD,NB,12K-12.5K,4
2/14/2022,Sample ENR2202120011,Outsole Furon 6 FG #PFG002,NB,9.5-10,1
2/14/2022,Sample ENR2202120011,Outsole Furon 6 FG #PFG002,NB,9.5-10,1
2/14/2022,DEV Tai Order_Outsole Generic NMZ X P2P3 MG Jr #21,Outsole Generic NMZ/X P2/P3 MG Jr #21316,Adidas,2-2.5,10
2/11/2022,Sample DEV THY_20220211_LEGO WINTERPLAY,Heelcap Lego Vintro Boot C #59052-HC,Adidas,11K-12K,20
2/11/2022,FRA210921,Heelcap Ultra 4D #AD30832,Adidas,8-9,20
2/11/2022,Sample VDM20220210-26-714,Outsole NB#MB3000V4,NB,6-6.5,3
2/11/2022,Sample VDM20220210-26-714,Outsole NB#MB3000V4,NB,7-7.5,6
2/11/2022,Sample VDM20220210-26-714,Outsole NB#MB3000V4,NB,5.5,3
2/11/2022,Sample VDM20220210-26-714,Outsole NB#MB3000V4,NB,8-8.5,3
2/11/2022,Sample EGR2202100004/EGR2202100005,Outsole Wire 8 #40534,Brooks,4-4.5,12
2/11/2022,DEV-THY-2022-02-11,Torsion Bar Solar boost Glide ST #AD-32573,Adidas,8-9,10
2/11/2022,DEV-THY-2022-02-11,Torsion Bar Solar boost Glide ST #AD-32573,Adidas,8-9,10
2/10/2022,SAMPLE: FMVN-21122801,Outsole Future MG #FB1095,Puma,8-8.5,10
2/10/2022,DEV REQUEST ( TOP URGENT),Shank Propelv4 #PROPELV4,NB,M:9.5-10.5/W:11-12,10
2/10/2022,DEV REQUEST ( TOP URGENT),Shank Propelv4 #PROPELV4,NB,M:5-6/W:6.5-7.5,10
2/10/2022,DEV REQUEST ( TOP URGENT),Shank Propelv4 #PROPELV4,NB,M:9.5-10.5/W:11-12,10
2/10/2022,DEV REQUEST ( TOP URGENT),Shank Propelv4 #PROPELV4,NB,M:5-6/W:6.5-7.5,10
2/9/2022,DEV THY_20220207_For workshop meeting,Midsole Climawarm T&P #57531,Adidas,8.5,8
2/9/2022,DEV THY_20220207_For workshop meeting,Midsole Climawarm T&P #57531,Adidas,8.5,8
2/9/2022,DEV THY_20220207_For workshop meeting,Midsole Climawarm T&P #57531,Adidas,8.5,8
2/9/2022,DEV THY_20220207_For workshop meeting,Midsole Climawarm T&P #57531,Adidas,8.5,8
2/9/2022,DEV THY_20220207_For workshop meeting,Midsole Climawarm T&P #57531,Adidas,8.5,8
2/9/2022,SAMPLE: VDM_2022/01/27+28,Outsole Future FG-AG #FB1118,Puma,6,10
2/9/2022,SAMPLE: VDM_2022/01/29,Outsole Future FG-AG #FB1118,Puma,8,10
2/9/2022,SAMPLE: VDM_2022/01/27+28,Outsole Future FG-AG #FB1118,Puma,8,10
2/9/2022,SAMPLE: VDM_2022/01/27+28,Outsole Future FG-AG #FB1118,Puma,8,10
2/9/2022,SAMPLE: VDM_2022/01/27+28,Outsole Future FG-AG #FB1118,Puma,6,10
2/9/2022,SAMPLE: VDM_2022/01/27+28,Outsole Future FG-AG #FB1118,Puma,8,10
2/9/2022,SAMPLE: VDM_2022/01/27+28,Outsole Future MG #FB1095,Puma,8-8.5,20
2/9/2022,SAMPLE: VDM_2022/01/27+28,Outsole Future MxSG #FB1119,Puma,8,10
2/9/2022,Sample ENR2202080024/ENR2202080018,Outsole Tekela 4 FG #PFG004,NB,7.5-8,4
2/9/2022,Sample ENR2202080024/ENR2202080018,Outsole Tekela 4 FG #PFG004,NB,6.5-7,3
2/9/2022,Sample ENR2202080024/ENR2202080018,Outsole Tekela 4 FG #PFG004,NB,11.5-12,2
2/8/2022,DEV REQUEST,Outsole ELMN8 V7 #40533,Brooks,9-9.5,1
2/8/2022,DEV REQUEST,Outsole ELMN8 V7 #40533,Brooks,9-9.5,1
2/8/2022,DEV REQUEST,Outsole ELMN8 V7 #40533,Brooks,9-9.5,6
2/8/2022,DEV REQUEST,Outsole ELMN8 V7 #40533,Brooks,9-9.5,1
2/8/2022,DEV REQUEST,Outsole ELMN8 V7 #40533,Brooks,9-9.5,1
2/8/2022,DEV REQUEST,Outsole ELMN8 V7 #40533,Brooks,9-9.5,6
2/8/2022,DEV REQUEST,Outsole ELMN8 V7 #40533,Brooks,9-9.5,1
2/8/2022,DEV REQUEST,Outsole ELMN8 V7 #40533,Brooks,9-9.5,6
2/8/2022,DEV REQUEST,Outsole ELMN8 V7 #40533,Brooks,9-9.5,6
2/8/2022,DEV REQUEST,Outsole ELMN8 V7 #40533,Brooks,9-9.5,1
2/8/2022,DEV REQUEST,Outsole ELMN8 V7 #40533,Brooks,9-9.5,6
2/8/2022,DEV REQUEST,Outsole ELMN8 V7 #40533,Brooks,9-9.5,6
2/8/2022,DEV REQUEST,Outsole ELMN8 V7 #40533,Brooks,9-9.5,6
2/8/2022,DEV REQUEST,Outsole ELMN8 V7 #40533,Brooks,9-9.5,1
2/8/2022,SAMPLE: FMVN-21101904,Outsole Ultra FG #FB1106 P3,Puma,3-3.5,10
2/8/2022,SAMPLE: FMVN-21101904,Outsole Ultra FG #FB1106 P3,Puma,5-5.5,10
2/8/2022,SAMPLE: FMVN-22012801,Outsole Ultra FG #FB1106 P3,Puma,8-8.5,10
2/8/2022,SAMPLE: FMVN-21101904,Outsole Ultra FG #FB1106 P4,Puma,3-3.5,10
2/8/2022,SAMPLE: FMVN-21101904,Outsole Ultra FG #FB1106 P4,Puma,5-5.5,10
2/8/2022,SAMPLE: FMVN-21101904,Outsole Ultra FG Jr #FB1107,Puma,5-5.5,5
2/8/2022,DEV-THY-2022-02-08,PANEL ULTRA 4D #AD30832,Adidas,8-9,15
2/8/2022,DEV-THY-2022-02-08,PANEL ULTRA 4D #AD30832,Adidas,8-9,15
2/8/2022,DEV-THY-2022-02-08,PANEL ULTRA 4D #AD30832,Adidas,8-9,15
2/7/2022,DEV REQUEST,Outsole Furon 6 FG #PFG002,NB,9.5-10,5
2/7/2022,DEV REQUEST,Outsole NB Composite COMPV1,NB,9.5-10,5
2/7/2022,DEV REQUEST,Outsole Tekela 4 FG #PFG004,NB,9.5-10,5
2/7/2022,DEV REQUEST,Outsole Tekela 4 FG #PFG004,NB,9.5-10,5
2/7/2022,Sample ENR2201190005 ( Giao kho PT)( rv07-feb,Outsole Tekela 4 FG #PFG004,NB,7.5-8,4
2/7/2022,Sample ENR2201190005 ( Giao kho PT)( rv07-feb,Outsole Tekela 4 FG #PFG004,NB,11.5-12,4
2/7/2022,Sample ENR2201190005 ( Giao kho PT)( rv07-feb,Outsole Tekela 4 FG #PFG004,NB,12.5-13,4
2/7/2022,Sample ENR2201190005 ( Giao kho PT)( rv07-feb,Outsole Tekela 4 FG #PFG004,NB,6.5-7,4
2/7/2022,DEV REQUEST,Panel EQ19 RUN #55178,Adidas,5-5.5,30
1/28/2022,DEV-TAM-2022-01-28,Outsole Evo Speed 5 NG FG J´s#FB1017,Puma,3-3.5,5
1/28/2022,DEV-TAM-2022-01-28,Outsole evoSPEED 360.5 FG#FB1010,Puma,8-8.5,5
1/28/2022,DEV-TAM-2022-01-28,Outsole evoSPEED 360.5 FG#FB1010,Puma,8-8.5,5
1/28/2022,DEV-TAM-2022-01-28,Outsole evoSPEED 360.5 FG#FB1010,Puma,8-8.5,5
1/28/2022,SAMPLE: VDM_2022/01/27+28,Outsole Future FG-AG #FB1118,Puma,8,15
1/28/2022,DEV-TAM-2022-01-28,Outsole Future FG-AG #FB1118,Puma,8,5
1/28/2022,SAMPLE: VDM_2022/01/27+28,Outsole Future MG #FB1095,Puma,8-8.5,10
1/28/2022,DEV-TAM-2022-01-28,Outsole Future MG #FB1095,Puma,8-8.5,4
1/28/2022,DEV-TAM-2022-01-28,Outsole Future MG #FB1095,Puma,8-8.5,4
1/28/2022,DEV-TAM-2022-01-28,Outsole Future MG #FB1095,Puma,8-8.5,4
1/28/2022,DEV-TAM-2022-01-28,Outsole Future MG Jr #FB1096,Puma,3-3.5,4
1/28/2022,DEV-TAM-2022-01-28,Outsole Future MG Jr #FB1096,Puma,3-3.5,4
1/28/2022,SAMPLE: VDM_2022/01/27+28,Outsole Future MxSG #FB1119,Puma,8,10
1/28/2022,SAMPLE: VDM_2022/01/27+28,Outsole FW20 Puma Future 2.0 #FB1064,Puma,8,3
1/27/2022,SAMPLE: VDM_2022/01/22,Outsole Future MxSG #FB1089,Puma,8,7
1/27/2022,SAMPLE: VDM_2022/01/22,Outsole Future MxSG #FB1089,Puma,7,3
1/27/2022,SAMPLE: VDM_2022/01/22,Outsole Future MxSG #FB1089,Puma,9.5,3
1/27/2022,SAMPLE: VDM_2022/01/22,Outsole Future MxSG #FB1089,Puma,10,3
1/27/2022,SAMPLE: VDM_2022/01/22,Outsole Future MxSG #FB1089,Puma,10.5,3
1/27/2022,SAMPLE: VDM_2022/01/22,Outsole Future MxSG #FB1089,Puma,8.5,5
1/27/2022,SAMPLE: VDM_2022/01/22,Outsole Future MxSG #FB1089,Puma,6.5,3
1/27/2022,SAMPLE: VDM_2022/01/22,Outsole Future MxSG #FB1089,Puma,6,3
1/27/2022,SAMPLE: VDM_2022/01/22,Outsole Future MxSG #FB1089,Puma,11,3
1/27/2022,SAMPLE: VDM_2022/01/22,Outsole Future MxSG #FB1089,Puma,11.5,3
1/27/2022,SAMPLE: VDM_2022/01/22,Outsole Future MxSG #FB1089,Puma,7.5,3
1/27/2022,SAMPLE: VDM_2022/01/22,Outsole Future MxSG #FB1089,Puma,9,2
1/27/2022,"sAMPLE VDM20220127-19-106; 107, 110;112;113",Outsole NB#MB3000V4,NB,9-9.5,6
1/27/2022,"sAMPLE VDM20220127-19-106; 107, 110;112;113",Outsole NB#MB3000V4,NB,9-9.5,60
1/27/2022,"sAMPLE VDM20220127-19-106; 107, 110;112;113",Outsole NB#MB3000V4,NB,9-9.5,6
1/27/2022,Sample VDM20220126-18-498==> 502,Outsole NB#MB3000V4,NB,6-6.5,6
1/27/2022,Sample VDM20220126-18-498==> 502,Outsole NB#MB3000V4,NB,6-6.5,42
